,judgement,title,score,id,num_comments,body
259,Not the A-hole,AITA for calling my parents assholes for what they did to my birthday,25128,kjoql2,3209,"I (21f) was one of those kids who was born on Christmas Day. Which I wouldn’t have minded at all if my parents treated this normally for example my friends boyfriend was also born on Christmas and he said his parents would do his birthday in the morning and Christmas in the afternoon and I wouldn’t have minded that at all. However my parents said it was greedy to have two celebrations on one day so I had to choose between having Christmas with everyone else ( my family and extended family) or have my birthday on Boxing Day and not take part in Christmas ( I wouldn’t have any presents or the chocolates and stuff everyone else would, I wasn’t even allowed to help with the Christmas tree)  This was pretty shit, either I had Christmas with everyone and wasn’t even wished happy birthday and because we wouldn’t be at school I never got happy birthdays from my friends or I was completely left out during Christmas and had a birthday where everyone was still focused on Christmas. And if I chose birthday my parents would tell my extended family I didn’t want Christmas and if I chose Christmas they said I didn’t want my birthday so I didn’t get both from my extended family. It made my childhood absolute hell and ruined holidays for me. My first Christmas/ birthday away from home was probably the best day of my life. Well cuz of Covid my family were talking about doing a zoom call for Christmas and my mum said “ well I guess op gets to chose to be part of the Christmas call or we call her on Boxing Day for her birthday “ I don’t know why but I just blew up and called her an asshole and said they ruined my childhood. It’s not like they couldn’t afford it my family is probably in the top 1% of the country money wise and even so I could’ve still taken part in festivities and only had one present. But my brothers are calling me selfish and my auntie says I need to apologise. And it’s Christmas so I feel like I should.Edit:OH MY GOD. THANK YOU EVERYONE SO MUCH!! I went to bed last night and woke up to about a million notifications. I’m sorry but I don’t think I can get through everyone but I’m definitely trying to!! I’ve had the best birthday/Christmas!! My best friend got me a Nintendo switch!! And we’re going to have a huge gaming competition together and we got leftovers of kfc for lunch!! Thank you all so much for the birthday and Christmas wishes I feel so honoured ! I love you all!!!"
260,Not the A-hole,AITA for calling a woman an idiot when she refused listen to why my daughter isn't vaccinated?,25128,lj2pxa,1708,"My (20f) 2yo daughter has had a heart transplant due to CHD and is severely immune compromised, as a result she cannot recieve live virus vaccines.I'm in a young mom's group on Facebook and the topic of daycares and being a SAHM came up. I said my boyfriend is the breadwinner and I stay at home with our daughter because I can't risk sending her to a daycare as she's not vaccinated. One woman, who is the same age as me with a newborn, started off, she's a new member, all the other women already know of my daughters medical history. She started calling me names and said I don't belong here if I'm so anti-vax. I told her my daughter is a transplant patient and can't be vaccinated. She just told me stop making excuses.I said, ""you're an absolute idiot, if you even looked at my profile for a second you'd know that I'm an advocate for vaccines and if you did a bit of research you'd know that giving someone who is severely compromised a live virus vaccine is a bad idea.""She was clearly very upset, she posted a rant about me onto the group and a few of the members said I was an asshole for calling her an idiot.AITA?Edit: If I could vaccinate my daughter or if I was confident every parent who sends there child to a daycare vaccinates their child, I would send her to one so I can work.Edit 2: I am not talking about the covid vaccine here"
261,Not the A-hole,AITA for bringing a baby to a class??,25118,inme22,1607,"hi please let me know because i’m honestly not sure. for context, my university is completely online, I’m male and 20 years old. Okay, last week, a family emergency happened, and it required my aunt and uncle to leave their house at late night. I live close to them, and they have a baby that’s less than a year old. So, they called my parents to tell them about the emergency, and then called me. They asked if I could come into their house, take care of their baby, until they came back, and I was down with that. I’ve taken care of babies before, so, this wasn’t new to me.Took my stuff, and drove to their house, stayed with my cousin. Now, by the time my morning class comes about, my aunt and uncle haven’t shown up yet, which was within expected (they told me they’ll be back by one-two PM), and I had my baby cousin in my lap, setting up laptop for my morning class, and my cousin falls asleep, and I’m like OK. I can deal with this. A sleeping baby is the best kind of baby. Do not move them. Now, here’s the problem. I had a presentation to do, and so my video is off, as I’m preparing to give it, and the professor goes “OP, please turn on your camera.”“Uhh. I have a sleeping baby right now, so… is that okay with you?”“A sleeping baby?”“Yeah, there was a family emergency, so my cousin’s asleep on me right now, um… I don’t want to say the details in class, but I can email you after class, and supply any proof you need.”“It’s fine, please turn on your camera.”So I do, and my cousin is asleep, and I give the entire presentation, and I’m really proud of how it went, because I think I did really well, and I answer all questions, and my cousin doesn’t wake up! Like this is the best case scenario.Well, last night, I got my grade for the powerpoint, along with an email from the professor that says she marked me down because she felt the baby was there as a pity prop, and I was attempting to gain sympathy, and if I hadn’t had the baby, I would’ve gotten higher.So was I the asshole for showing up with a baby? I didn’t think about the pity aspect.edit :- sorry for the sporadic replies. i am still a university student balancing my shit. few clarifications. Yes, I did send her the proof she would’ve required to see there was an emergency. Yes, I will be reporting - and updating. Yes, there are better ways I could’ve done this, but a stressed and sleep deprived student isn’t normally the best source of judgement. The class was a philosophy one."
262,Not the A-hole,AITA for telling my stepdaughter she’s absolutely under no circumstances allowed to switch out my cats food for vegan food even though she’s losing weight because the sight of normal cat food makes her sick?,25077,ghwz34,3784,"Sorry for the appalling title. My stepdaughter is living with my husband and I for the next year. Shes an educated young professional who’s saving up to buy her own home. Since she’s moved in with us (past 3 months) she’s become increasingly snappy and unhappy with how her dad and I run our lives. We aren’t environmentally conscious enough because we don’t compost our waste, we are negligent because we leave lights on when we leave our home for security reasons, we should switch to electric cars, we are contributing to the inhumane treatment of cows by consuming dairy, the list is endless. My cat Mango is getting to be an old ass man and he has lived a full life of eating whatever the fuck he likes (obviously within what’s safe for a cat) and hes happy that way. My stepdaughter is now insisting she will purchase vegan cat food because seeing Mango eat meat makes her sick. We feed him in the kitchen and she will literally throw up / retch/ leave the kitchen if she sees him eat meat. She HAS lost a lot of weight since claiming that seeing Mango eat meat makes her sick, and we leave out dry biscuits for him to snack on which also makes her sick. It’s not like we leave mess out but even if she smells his food in the am (which is gross, yeah, but the doors are open and that’s just life if you have a pet) she will heave and walk away. Her dad and I both told her if she’s unhappy with it she needs to find someplace else to live and although we are genuinely sorry she’s lost her appetite and has lost weight we aren’t going to change Mangos lifestyle- she has yelled, cursed at us, cried, begged, etc, but no, we are NOT happy with Mango eating a vegan diet. We don’t feed him cheap crap either, we feed him food quality cat food that isn’t processed or full of sugar or grain. It’s pretty much gourmet Gordon Ramsey worthy cat food. My MIL has waded in after my stepdaughter told her we were being unfair by refusing to let Mango go on her preferred diet for him, and is accusing us of being cruel and shortsighted. She says we are letting her get sick, and that Mango won’t hurt from a change in diet but stepdaughter is hurting."
263,Not the A-hole,AITA for putting bacon on my lunch to keep my Muslim friend from stealing it,24996,fg57ge,2365,"I’m not a super healthy person. At school for lunch, I usually get cheese fries. I know, very unhealthy. But one of my friends sure likes to steal my fries, as well as food from our other friends at the table. He’ll grab a bit from our trays and eat it when we’re not looking sometimes. It’s not usually a lot; it’s more so just a nuisance. So I had an idea. My friend who likes to snatch our food sometimes is Muslim, and he keeps halal. Our school cafeteria gives us the option to get bacon on our fries too (I love America). I wouldn’t get bacon on my fries otherwise, but I would rather do that than set a precedent of my friend stealing my food. When I first sat down at our table, he said “What the fuck man? Why’d you do that?” My friends sided with him. They said I went too far by not “respecting” his dietary restrictions. Too which I replied, “his dietary restrictions shouldn’t matter if he doesn’t eat my food”. I think I was totally in the right to do that, but my friends just thought it was petty because I didn’t get bacon before and I only started getting it to give him the finger. Thoughts?"
264,Not the A-hole,"AITA For building a Fence and blocking my neighbours from the road, forcing them to take a massive detour?",24994,ics68m,1277,"So I am the owner of a large house with a huge property surounding it. When I bought my property 5 years ago I basically lived at least 5 minutes away from the nearest house, however the villages and towns have been expanding and as a result started developing houses next to my property.I was fine with it, nothing I could do about it to begin with, but my property is big enough not to really notice to begin with, or so I assumed.It's good to mention I basically pulled out a bunch of trees when I moved here and made a dirt road with gravel of sorts to allow me easy access to the main road nearby instead of driving all the way around to access the main road.Well soon after people started moving in to the houses I noticed people basically used my little road to access the main road nearby and kids used my field to play football, I was pretty much okay with it because it wasn't bothering me or inconveniencing me.Untill a few months later that was, basically whenever people had a party or a gathering I noticed my road and the field which they drove over was full of cars and a few weeks later some people started straight up using it as a parking area. I had multiple talks with multiple people and the results ranged from apologetic people moving their cars to aggressive people who told me to go F myself.I finally had enough and started getting cars towed which led to people yelling at my girlfriend in particular, as such I build a large stone fence around my entire property.Well multiple neighbors including the aggressive ones were all apologetic and asked me to remove the fence and how sorry they were for using it as they basically had to add 15 to 20 minutes to their travel time to work without my shortcut, I told them to go F themselves and to get the F of my property and if I saw them there again I'd be letting my dogs loose.However this is also impacting the nice neighbors so I am conflicted."
265,Not the A-hole,AITA for threatening to financially cut off my son over a baby name?,24989,ht049f,2722,"I had my son fairly young and I recently had a change of life baby. When I was four months pregnant my son, who was in college at the time told me that he had gotten his girlfriend pregnant. I wasn't very happy but I've been supportive and I've given them a lot of financial assistance.I had my daughter two months ago and named her Clara. My son's girlfriend went ballistic. She said they were going to name their daughter Clara and that I should have consulted with them (umm I got pregnant first, but whatever) I told her she needs to grow up and that she doesn't own the name. My son asked me if I would consider changing Clara's name. I said no and he stormed out of the house.Well they told me the other day they are going to name their daughter Paxtyn. I guess I made a face and she started yelling at me that it is my fault, because I stole the only name she likes. I even asked her if she likes the name Paxtyn and she said she is going to like it when I have to tell my friends I have a granddaughter named Paxtyn. So she pretty much said she hates me more than she loves her daughter.My son said I have two months to fix this (change Clara's name) and I told them that they are both idiots, and I feel bad for their future child. I also said if they name their daughter Paxtyn just to be spiteful I will not give them any further assistance. My son called me up and said I was being controlling, but when I asked him if he actually likes the name he hung upEdit: They never mentioned the name Clara to meSecond Edit: Alright, I took some of your advice and texted her that I've been thinking about it and I kind of like the name Paxtyn and she wrote back ""fuck you, you evil bitch"" so I think that's the end of their money."
266,Not the A-hole,"AITA for telling my mother that my step dad will not be walking me down the aisle because I hate him, and in turn ripping my family apart?",24958,ekwwcq,2496," I (23) am getting married to my boyfriend of 6 years in June. We're having quite a large wedding (fiance has a big family, and we have a lot of friends), but my family is very small. My only family is my mom (never met my dad), and I have an aunt and uncle who are childfree. Since I was little, having no father I always wanted my uncle to walk me down the aisle.My mom married my step dad when I was 12, and I've never liked him. He's a bully. He says horrible things to people, says racist, sexist, transphobic things for attention, and heavily contributed to my mental illness and eating disorder as a teenager. My mom knows that we don't get along, and she knows I didn't like him, but I gave up on confiding in her about how much I disliked him when I was around 15, because she would always insist that despite having a nasty mouth, he was a really good guy and he would never hurt us. So, it's been around 8 years since I've told my mom I hate him. I moved out when I was 19 with my boyfriend. I visit my mom maybe 3-4 times a week, I would try to time this around my step dad working so I wouldn't see him. As a result of seeing him less, I was more able to ignore his horribleness and we stopped arguing. I mostly stopped talking to him. He still refers to me as his daughter and my mother insists he loves me. It is not mutual, but everyone has assumed that I love him too and our relationship is just based on 'banter' rather than tormenting.So, when I got engaged, I asked my uncle almost straight away if he would walk me down the aisle. He was over the moon, but my aunt was like 'oh, you aren't picking step dad?' and I said no, I've always wanted uncle to do it. A few hours later, my mom called me crying asking why I wouldn't want step dad to do it, saying it's broken his heart. I told her that I've always dreamed of having uncle do it. She pressed on about how heartbroken he is, saying he always thought we had a good, funny relationship. This is where I feel like an ass. I said, 'there was nothing funny about him ruining my self esteem and teenage years. I hate him and if it were up to me, he wouldn't even be at the wedding'. My mom said that she's horrified that I still feel this way, once again spouting that he's a good guy and he loves me. I repeated that I hate the guy, and she said she'll tell him to back off.He's now angry at me and has asked my uncle not to walk me. My uncle is now not speaking to him, and I feel like I've torn what little family I have apart. AITA?"
267,Not the A-hole,AITA for kicking girlfriend out after she deleted dead wife’s pictures from my phone?,24947,hy04og,3100,"My (25m) wife died 19 months ago. It was real hard on my the first few months but finally started putting myself back out there. I met girlfriend (23F) 7 months ago. It was going pretty well and she moved into my apartment around 4ish months ago. In hindsight we probably rushed this.My girlfriend is very overprotective and clingy and scared of me cheating as she’s been hurt in the past. I let her have my phone password so she could ease her mind. She saw a photo of me and wife and asked who she was and I explained. She seemed to take it well but was a little bit awkward about it.Fast forward 3 days and I go to take a shower and leave my phone on charge in the bedroom. I come out to see my phone unlocked. Weird but I let it slide. Later in that day I go through my photos to upload a new profile picture to Facebook. All the photos of my wife and me and her together are gone without a trace. I check my Snapchat my eyes only because I had a few in there along with intimate photos of us together. I knew it was my girlfriend.I confronted her about it and she started yelling. She said I need to get over it and get rid of all the reminders of my wife because she was here now. She also called me really creepy for “having nude pictures of a dead girl”. (Granted i probably should have deleted those a long time ago but I didn’t want to because they were special to me, might be AH on my part there). I was livid. I told her to get out. She stared at me in disbelief as I told her again. She packed some stuff and left. I went to my room and cried. I woke up to many missed calls and angry texts from her and her friends for calling me the AH. This might not have been a big deal but she permanently got rid of 95% of the pictures of my wife. I still have some printed like the wedding and some vacations, but I’m still missing a big chunk of them. I feel like she deleted a part of me as well. I’ve had to block multiple numbers (including my sisters, wtf). I do miss her though and want to talk but I’m confused. Reddit, am I in the wrong?Edit: SpellingEdit 2: Thank you all so much for your kind words and support. I’m taking your advice and kicking her out of my life for good. I’m also going to my local tech store later as they said there might be a way to recover my photos. I love you all !"
268,Not the A-hole,"AITA for supporting my wife after my daughter publicly exposed her diary which had ""cruel"" comments?",24959,hqgdyb,2620,"I have been remarried for a year now to my wife. I have a 15 year old daughter and a 11 year old son from my first marriage. I also have a 15 year old stepdaughter.My wife has always gotten along with my children very well and has gone above and beyond to integrate our families.And although at first my daughter was very standoffish to my wife, my wife was eventually able to bond with her. Only then did we get married.A few weeks ago, my daughter found my wife's diary that she had been writing to when we went to marital counseling before we got married. Both our first marriages were terrible so we were determined to do it right. I also was given a diary.My daughter then proceeded to read everything and even take photographs of certain pages. She then posted the photographs on Facebook and called my wife a bunch of cruel names.My wife had written a few things about how she wished I didn't have kids before we met so we could have had less issues dealing with my ex.She also said how she hated that my daughter had picked up so many bad traits from my ex.And the last thing related to my kids was that she said my ex was a terrible mother for weaponizing her kids.I admit I was taken aback and upset that my wife had written these things because I knew my kids would be hurt.But this was also a personal diary as part of a therapy exercise and the diary had been hidden in our closet.My daughter even posted some very sensitive information about my wife dealing with her father who was an alcoholic.My wife is inconsolable. A lot of my family and friends have turned on my wife because they think what she wrote was terrible.I disagree. She wrote things that she was concerned would affect our marriage and the counseling actually helped us deal with having stepchildren. And it's not like I shared the same opinion about my ex.I'm just so defeated. My daughter will no longer see me if my wife is around and won't step foot in our house. My son is following her lead. My wife has already apologized several times.My ex has said she will be starting the process to reduce my custody and sue for defamation. I know she won't win the defamation case but I feel like custody will indeed switch. I'm very stressed out.My daughter refused to take down the diary pages and insists she's in the right.I have taken my wife's side in all this. Am I the asshole? My entire family has been blown up."
269,Not the A-hole,"AITA for giving my child a ""culturally inappropriate"" name?",24954,el460c,4752,"I am black, and my wife is also black. I spent my most of my childhood in the foster system, but for a good part of it I was taken care of by an elderly Russian gentleman (we'll call him Dimitri Petrovitch). While he never formally adopted me, he played a major role in my upbringing, and I am very grateful for all that he has done for me. Unfortunately, he passed away many years ago, and he never had any children. Fast forward to today, my wife and I recently had a son, and to honor the memory of my mentor, I decided (with my wife's approval) to name my kid Dimitri Petrovitch Williams. Williams being my last name, and Petrovitch being my son's middle name. However, it seems like it's only my wife and I who likes this name, as her extended family has been quite upset over it, saying things like ""What kinda name is Dimitri?"", or ""You ain't white, you ain't Russian, why did you give your son such as a white name."" It's true that there's no part of me that's Russian (I an barely speak Russian), but I feel like he's been such a big part of my upbringing that I had to honor him somehow. I confided in my friends too, and they said something along the lines of ""You a black man and you gotta be proud of your own culture. You gave your son an identity that he's not even a part of, he's gonna have a hard time in school with that name.""So my wife's family aren't happy with our decision, and it seems like my friends don't really have my back either. I'm keeping the name that's for sure, but should I have reconsidered? Maybe I could've honored my mentor in another way?"
