,judgement,title,score,id,num_comments,body
171,Not the A-hole,AITA for changing my name? my parents named me Qur'stylle (Chrystal)?,27531,g1bn71,2589,"So my asshole scumbag parents named me Qur'stylle and my whole life i have gotten shit like ""are you muslim"" ""what language is your name originated from?"" ""what country are you from"" and people butchering its pronunciation, for obvious reasons. I have always told people to just spell it as Chrystal and my parents (mainly mom) would take huge offense to it and would email my teachers every year to make sure they pronounce my name correctly. My mom even grounded me once because I told people to just make save my name as Chrystal in their contacts. Now that I'm a legal adult i got my named changed to Chrystal so now i don't have to deal with this fuckign bullshit for the rest of my life. Having this bullshit spelling and having to correct everyone everyday was annoying as hell and everyone before they met me would always think I'm some spoiled brat bitch when that isn't true at all. Your name affects how people see you, much of it is subconscious, and having these bullshit spellings is not good. My mom lost her shit and started crying and threatened to cut me off for doing this. She said i betrayed her and our family by doing this. Im pretty sure I'm in the right but i need a sanity check here. I told my mom to go fuck herself and fuck her for causing me all these problems in my life and not supporting me and taking my complaints into considerations over my own fuckign name. My mom is a cunt and my dad is a spineless coward."
172,Not the A-hole,AITA? My husband won’t let me sleep.,27465,hjc6zy,1724,"Ok, so I work 12 to 16 hour shifts at an extremely labor intensive job that requires the use of heavy machinery. My job is dangerous and I need to stay focused while at work. This part is important. So, my husband has a friend who is a truck driver. His friend calls at odd hours every night. (Usually between 1am and 4am.) My husband always accepts these calls and then proceeds to have very loud, very long conversations right next to me which inevitably wakes me up and keeps me awake. I have asked him firmly, but politely, to either take the calls at a later hour, or to leave the room while he talks so that my sleep is not disturbed. He refuses to do this, and says that he has to answer the calls to help keep his friend awake while he is on the road. I understand wanting to help a friend, but I do not understand needing to keep me awake while doing it. So, for the last week, I have been locking myself in the guest bedroom and sleeping on the guest bed when I have a shift scheduled. Now my husband is angry and says that it hurts his feelings that I am no longer sleeping next to him every night. AITA?"
173,Not the A-hole,AITA for telling my roommate that the name she chose for her baby is ‘ridiculously stupid’?,27466,j0z5qn,2615,"My roommate  (24f) is a big Game of Thrones fan. She’s pregnant with her first child right now. She decided to name her baby, ‘Arya’. When she asked my opinion of this name, I said I it was a good name with a good meaning (Arya means noble in Sanskrit), but a lot of people have named their kids Arya/Khaleesi/Sansa because of the popularity of GoT and it might be a little too common, not that it is a bad thing.The next day, which was yesterday, she said she’s found a way to name her baby ‘Arya’ and not have it be associated with other Aryas running around or the show. How? She said she wanted to spell it as *Aughreighyah*. I did a double take reading that word too, but apparently people are supposed to read it as Augh-reigh-ya or Arya. She asked me how I felt about it and I told her that, frankly, Aughreighyah looks ridiculously stupid and she should just go with Arya. She got kinda upset and said that she and her partner came up with this only because I told them that the name is very common. I said that having a common name is better than having a confusing name. AITA?"
174,Not the A-hole,"AITA for refusing to share a room with a 1yr old, twin 2yr olds and a 4yr old?",27437,hjkqvx,2077,"So I F(18) was recently invited up to my aunt and uncle’s (I’ll call them aunt and uncle B) ranch house for the 4th of July, and told I could bring a friend. Now, this aunt and uncle have a pretty big house. Their ranch house has four bedrooms with queen beds, the master bedroom, and the “kids room” which is a massive room with about ~6 beds (some bunked), and a loft. They’ve got a lot of land around the house too, so I was excited to get some time to goof off and run around with my friend (also F18). I know that other cousins are going to be there, and assume that my aunt B and uncle B thought beds through and everything like that.The other people invited up to the house were Aunt G and Uncle G and their son M16 who I’ll call F, my Uncle P, and my Aunt and Uncle H.H’s are baby cannons. They have four kids under the age of 5, none of whom sleep through the night (I’ve been to their house before, it’s horrible). Anyway, my friend and I get up to the house and learn that WE are expected to share the big bunk room with the kids under five, while their parents get their own room. Uncle P, cousin F, and Aunt and Uncle G, are also in their own rooms (G’s shared one).I was upset. But, wanting to stay up there, I said okay, my friend and I can sleep on the couch.Cue a MASSIVE explosion.The baby cannons are pissed that I don’t want to sleep in the same room as their children. Their kids are horrible at night, and someone needs to watch them, so it should be me and my friend because I got to invite a friend. I said that if they wanted someone to, cousin F could, but cousin F apparently needed his sleep because he’s a “growing boy” and he “doesn’t know how to take care of kids”.None of the other people in the house wanted to get involved. The aunt and uncle who own the house didn’t care much and just told us to figure it out. So I ignore the baby cannons and set up on the couch with my friend.Cue the baby cannons mother. She throws all of our stuff off of the couches and tells me and my friend that we HAVE to sleep with her kids or we can’t stay. At this point, I’m mortified by her behavior because I have a friend. My friend is embarrassed and doesn’t know what to do.So I tell them I’m leaving.Cue more screaming.I drove up my father’s boat, if I leave, there’s nobody with a truck to drive the boat around, the world is ending.I say that either my friend and I are sleeping on the couch, without the small children, or we’re leaving.Well, baby cannons weren’t okay with that. So, I packed up my stuff, reattached the trailer for the boat, and left.Now I’m getting texts from relatives that I was rude and could have handled it better, and that the baby cannons need a break from their kids and I’m young so I can be a nice family member and deal with it for them. AITA here?UPDATE 7/1; My father has banned the baby cannon from ever going on the boat again. Aunt B is getting involved and is considering asking the baby cannon family to leave for the weekend and to not come back until they can be more considerate of relatives. Uncle B is offering to pay for me and my friend to go on a backpacking trip (my friend and I go a lot), and says that he feels bad for how the baby cannons acted."
175,Not the A-hole,AITA for not telling my ex I got pregnant,27427,h83lq5,1898,"I (28 F) was with my ex-husband for about 6 years. During this time, we were trying for a baby but had no success. About 4 years into our marriage, our marriage had a rough patch. My ex had stress had work and slept with his coworker to ‘relieve’ it. He confessed to me rather quick and a week later, they sat me down and told me they were expecting a child. I was an idiot back then and so I felt like I should forgive him because I truly believed he loved me and I thought I had no one.  It wasn’t. My ex’s family treated me like their own, but my ex’s supposed daughter was the apple of their eye. As a result of that, my exs coworker was frequent presence in our lives. They felt like they had to include the mom of their grandchild for everything too and she made her way in every family picture and memory. It didn’t help that I suspected that the coworker had feelings for my ex and flirted with him when she can. People thought that she was my exs wife constantly and I finally had enough when during the baby girls first birthday party when I was told to take a picture of my ex, his mistress, his daughter, and his parents and it didn’t include me. It hit me that I was now treated as the other woman and I realized that I deserved more than this bullshit. I filed for divorce a few months later and left. It was the hardest time of my life but I ended up getting a promotion at work and met this sweet, wonderful guy. Fast forward to now, me and my boyfriend are madly in love and I gave birth to an adorable baby girl that I considered a miracle baby. I got pregnant with my boyfriend like 3 months after dating him and I thought that it was strange that this could happen since my previous failed attempts with ex and had thought that I was the infertile one. It crossed my mind then that maybe he was the infertile one and he only believed mistress was pregnant with his child because they were having an affair. I didn’t say anything though because it was not my place anymore. However, my boyfriend was so happy about my daughters birth and posted it on Facebook and tagged me in the post. I was still friends with my ex SIL on FB and she saw the post. She called me up and said that she was hurt that I didn’t let her know that I could actually get pregnant and the lack of child during my first marriage could be my ex’s fault. He took a paternity test. The poor baby girl was NEVER my ex’s. The coworker apparently was dating this ‘terrible’ guy during the time she slept with my ex and didn’t know who the child’s father was so she just strung my ex along cause she had feelings for him and thought he’d be the best father for her child. Now my ex blames me for not telling him that I was pregnant way before and him having to father this girl. He’s doing pretty bad now and I can’t help but feel guilty like I should’ve told him.EDIT: I didn’t realize that I could edit my post even after the 3000 character limit. Okay so first of all, I keep seeing that people have seen other posts like mine and some youtube video (??). If so, I’m upset that others have had similar situations as me and that some people find the situation so hilarious that they make a video out of it. I’ve also never posted on reddit before (I had a previous account for browsing not posting). I don’t think I have to prove my story and I honestly posted this not to seek validation that my ex supposedly is the worst ever, but to gain perspective since my ex and his family were MY family and close confidantes for a large period of my life. We were pretty close and I had promised to keep in touch after the divorce (which they were super upset about), but I really couldn’t after everything that happened between us. They’re now super pissed at me for the divorce and for being complicit in my ex taking on the expenses of his not-daughter and forming a paternal connection with her for longer than he should’ve. EDIT: So here’s what’s been happening right now, I haven’t spoken to them after this and have been avoiding my ex’s calls. He texted me saying that he is sorry and overreacted and felt guilty about prioritizing ‘people who were never really family’ over me. I only replied with asking how his daughter is because even though she isn’t biologically his, she’s still his girl. She seems like an adorable kiddo and adores her dad :(. My ex‘s mistress is able to support the girl financially so my ex won’t contribute to that but he says that he’s still going to see her every month because he feels morally obligated to. I feel bad for the girl so much because she seems to have lost her family unit (dad, grandparents, cousins)."
176,Not the A-hole,AITA for telling my daughter that I absolutely do not support her ONLY wanting to be a Stay-At-Home-Mom?,27374,iunsyq,2541,"I don't have a problem with the idea of parents who stay home with their kids. It's not like that. I get that childcare is expensive, and that often times it just makes sense.What I have a problem with is my teenage daughter literally planning her life to *only* become a SAHM. As in, no college, no jobs, no certifications, nothing at all to support herself until that time might come.I told her that it doesn't have to be college, that not everyone needs college. But that she needs to do *something* to start making money to put away so that, if anything goes wrong with her plan, she has a way to support herself and the potential kids.Her feedback was that her backup plan was me and my husband -- she would move in with us and go from there. We would help them survive. I told her then, what happens if we die, or we're incapacitated? She said ""I don't know, Mom, this is ridiculous, none of it is going to happen.""I told her bluntly that I don't want her becoming Nancy Botwin 2.0, that if something happens, she *needs* to have a backup plan and something behind her other than relying on other people. I emphasized that again, it *does not need to be college*. She can start working retail to learn customer service skills that she can carry onto doing call center work from home if need be. She can start working as a receptionist somewhere, she can do any number of things. But she says no, she's going to plan to be a SAHM.With that all in mind, I asked her, when she graduates high school, what is she going to do? She said ""Just try to find a husband. Maybe marry someone in the military."" I asked her again, in between that time, how is she going to pay her bills? Her rent?She said she assumed she would be living at home.I told her no, and that she would be moving out. She could live at home if she gets a job or tries to get some kind of community college degree or certification. But that if she insists on being a deadbeat loser and waiting for a man to come and rescue her, she's on her own.This didn't go over well, and I am now being held up as totally unreasonable, mean, a huge bitch, etc.I don't think I'm wrong at all. I want to set her up for a lifetime of success and happiness. If this wonderful man who comes and whisks her away, knocks her up, etc, gets injured or dies, I don't want to have her come knocking at our door because she can't afford to take care of herself.AITA?**ETA:** Ohhhh my god, I posted this when I was SUPER agitated and walked away and forgot about it and came back to see all of the responses. Holy shit. Give me a few minutes to catch up. Damn."
177,Not the A-hole,AITA for accidentally calling out a new colleague on lying about her language skills?,27363,logumz,1928,"Last week a new colleague ""Cathy"" (33f) started at my (25f) work place. She instantly stood out in the team, because she seems like someone who is very... loud and assertive? Two of my colleagues, me and Cathy were having coffee in the break room (we were the only ones in there and we were sitting far apart), when the subject of travel was brought up. My colleague said she wasn't booking trips anymore because it'll probably get cancelled because of covid anyway. Cathy, immediately cut in about how sad she is because she travels so often and she goes on these far ""exotic"" trips to Europe as her hobby. When I think exotic I think the Bahamas or something instead of Europe but. Cool.Cathy then jokes about how all this ""no travel business"" is making her fear that she'll lose some of her foreign language skills. I asked what languages she spoke. She claimed to be fluent in 3 European languages, among which were French and Dutch. Cathy said she was ""at a native speaker level"" and went on about how people in Europe were always surprised when they found out she wasn't from there.I was excited, because I never get to speak Dutch over here. I was raised in Belgium, which has three national languages: French and Dutch (which are my mother tongues and the most commonly spoken there) and German. It's quite common to be pretty fluent in at least two out of the three languages in Belgium, because you're required to learn them at school (along with English) from a young age. I told Cathy ""oh leuk, dan hebben we iets gemeenschappelijk!"" (""oh fun, we have something in common then!"")She immediately pulled this sour face and asked me if that was supposed to be Dutch. I said yes. She laughed awkwardly and said she ""couldn't understand because I have a terrible accent and must not be that good at speaking it."" Now see, I don't have an accent. I speak Dutch more fluently than I speak English. I told Cathy that I grew up speaking Dutch and speak it to my family all the time.She got miffed and asked what languages I speak and where I'm from. I told her I'm from Belgium, so I also speak French and I added ""which you just said you speak as well, cool! We can speak French instead!"" I acknowledge that I was a bit of a dick here, because by that point I knew she probably lied about speaking French as well. She then shoved her chair back and angrily got up, said ""whatever"" and stomped off. It was awkward. My other colleagues just kinda shrugged and said she shouldn't have lied.However, she later approached me and told me I embarrassed her by acting ""superior"" about my European heritage. I told her there was no way for me to know she'd lied about speaking those languages. She rolled her eyes and told me I was immature. A colleague told me that Cathy had called me a ""little b-word who enjoys bullying new colleagues"" behind my back later. I don't think I was a bully at all, but I don't want this to turn into a huge thing. Do I just apologize to keep the peace? AITA?\_\_\_\_\_\_\_\_\_\_\_\_\_\_\_\_\_\_\_\_\_\_\_\_\_\_\_\_\_\_\_\_\_\_\_\_\_\_\_\_\_\_\_\_\_\_\_\_\_\_\_\_\_\_\_\_\_\_\_\_\_\_\_\_\_\_\_\_\_\_\_\_Edit1: I'm not sure about escalating this to HR, which a lot of people have told me I have to do. I feel like this might make me look immature to the rest of my colleagues (of which I am the youngest) and it might not need to go that far... It depends on if Cathy is willing to put this behind her and be professional. If all else fails I do have ""witnesses"" who would be honest about what happened, so I think I might be in the clear if she tries to twist the story. Edit2: Some people have taken offense to me giving the Bahamas as an example of an ""exotic"" place and are trying to make this into a race issue. I didn't know ""exotic"" was an offensive term in the US. Do I think of The Netherlands, Belgium, England, Norway, which were countries she was describing as being faraway exotic destinations, as my idea of an exotic trip? No. Not because there's a lot of white people there, but because when I think of exotic I think of a place with nice sunny weather, white sand beaches and a blue ocean. Maybe it's because I'm from Belgium, but I don't really feel like being in my home country where it's dark and rainy all the time is quite that experience. Edit3: Some people think she might not have understood me because she is fluent in Dutch, but learned it in the Netherlands, which has different accents. While it is true that The Netherlands and Flandres have different accents, I didn't speak a very specific dialect like West-Flemish or something. I spoke the general Dutch you'd see in the news in Flandres. I didn't speak quickly to try and make it incomprehensible to set her up. I genuinely believed she spoke Dutch because that's what she was saying, so I talked to her in normal, conversational Dutch. The same kind of Dutch I'd use in a work environment back in my home country, the same kind of Dutch I use with friends from The Netherlands. (But with a soft ""g"" lol.) "
178,Not the A-hole,AITA for not letting my cousin experience motherhood?,27329,idg5xh,3659,"I have a cousin by marriage (husband's cousin) that's 22 and dying of cancer. It was always her dream to marry and be a mom and now that's not going to happen. It's hard on everyone. She has a much older fiance (30) and they had a symbolic wedding so she could have the experience.They started looking for ways to get access to a baby that she could take care of and experience some level of child care that way, but with 2020 and ethics in general, there's not a lot of ways to do that safely. My husband and I have the first and so far only children of our generation, who are 10 months and 23 months old.I had hopes that it wouldn't happen, but her parents asked me if she/they could borrow my younger baby for ""a few weeks"". The cousin and her fiance would basically be playacting having a baby. Her parents would also join in on pretending. There would be photoshoots and everything. This makes me really uncomfortable.It's really creepy. I cannot understate how creepy I think this is. I know that her not getting to live her dreams is sad, but I don't think this is the answer.I'm worried it will be traumatic for my baby. She's almost a year old and will, well, notice that her entire family will just vanish overnight for what will seem like forever. She's also still nursing, and they don't really seem to care about this factor.I'm really worried about problems down the road. This is setting a dangerous precedent of my child living under other guardianship. Her parents will have time to get attached and they could try to use that for familial pressure if not legally. Her fiance is also a wild card in that regard.I said no, and my husband's entire family is hounding us about this because her time is running out and it's time sensitive. They say we're being selfish. They say that we could use this as a free vacation and bond with our older child because I ""popped them out so close together"". They want to compromise now by letting me come by a few times a day to bring milk. We still don't want to do this. AITAEDIT/UPDATE:Yesterday afternoon, we got an email from the cousin's parents offering actual dollar amounts for us to agree. We got enough from that to file a police report and at least get the threat in writing. We also had a call with my husband's parents and his siblings to basically clear the air. Apparently what they were telling people they asked for and what they were actually asking for were very different. Everyone on that call now had them blocked on social media except for MIL (because of the cousin)."
179,Not the A-hole,"AITA for dropping the ""We're Not Having Kids, Now Stop Bringing It Up"" bomb on my MIL?",27263,b5hirx,306," My husband and I don't want kids. My MIL is big into family in the traditional sense. She has been pushy with us about having kids since we got married. Literally the week after we got engaged, she started asking.My husband has always changed the subject, and has even told her that it's really none of her business. Every time we see her, she asks. Everything we do is built around the idea of use having kids. 3 years into our marriage, my husband said ""We might not even have kids"" and MIL would *not*hear it. At year 4, husband had a vasectomy and I had a tubal.So this weekend we were all at their home enjoying some BBQ and drinks and everything. When I get up to grab a beer, my MIL asks me if maybe I should drink water instead, because wink wink nudge nudge, you never know.I was annoyed by this and said ""There's really no chance.""MIL, all wide-grin, said, ""Oh come on! It's time for you two to finally get serious! Put down the beer and tell us when we can finally expect you two to finally make your family official!""I said ""We've been official for about 5 years now, MIL,"" and drink the beer. Husband laughs with me.MIL gets more annoyed and says ""Well, you won't be REAL (Lastnames) until you bless us with babies!""Husband said, ""Mom, enough."" MIL pushed again. Husband repeated.After about fifteen minutes of the usual comments, I finally snapped and said ""MIL, Husband got snipped. I had my tubes tied. We're not having kids. You need to stop bringing it up. Period.""Well, I thought I started WWIII. She started crying and stormed off. Family looked at us with disgust and stormed off to comfort her. We left. Party kinda ended. The social media bullshit started shortly after. Vague posts, links about how motherhood is a woman's greatest calling, listicles about how unhappy childless women are, etc. Some meme about how ""I guess I wasn't a good enough mother and won't be graduating to grandmother."" It's obnoxious to the point that I just muted all of them.My MIL finally called me this morning and told me that she was willing to put this all behind us if Husband and I came over and listened to her reasons that we really ""need"" to have kids. I told her no, that we are tired of her pushing this on us, and then she said ""Well then, I guess you two aren't prepared to be REAL (Lastname)s. I'd like a refund for what we paid for the wedding."" (It wasn't that much. It was like $400 for the rehearsal dinner.)I hung up on her. When recounting this to my friends, a few of them said that I was the asshole here for dropping it like that. But I don't think she was ever going to drop it if I didn't finally make a serious, direct comment about it. So AITA?"
