,judgement,title,score,id,num_comments,body
0,Not the A-hole,AITA For suing my girlfriend after she had my 1967 impala project taken to the scrapyard?,70809,gr8bp3,2789,"I'll try to keep this short. I had a [1967 Impala 4 door]( that I bought in Feb 2019. A couple months ago I bought my first house that had a 2.5 car garage. I moved the car in and started tearing it down for a complete restoration. I had the body in one bay and the chassis in another, plus the whole garage filled with parts. About two months ago my girlfriend came to live with me during this whole crisis and the whole time has hated that car. She wants to park in the garage but I have 2 acres of land with a lot of nice places to park under shady trees or hell even in the barn if it has to be inside. I tell her tough luck its my house and its not like I can just throw it back together real quick. Anyways I was out of town for a couple days on a business trip for the small local company I work for. When I got back, my girlfriend was all smiles. Making me food all the time, doing all the chores, all that. I though maybe she just was happy to have me home but then I realized that I didn't see her car in it's usual spot. I asked her where she parked so I could make sure I mow that area and keep it clean and she said not to worry because she parked in the garage. I asked how and she told me to go check it out. Turns out that while I was gone she hired some people to come over and move everything related to that car, including the drivetrain, body, and chassis and all parts, and take it to the local dump/scrapyard. I was absolutely dumbfounded. I had spent over 11k on that car including new parts, services, and the car itself. I told her that I was going to be taking her to court for that and she brushed me off like I was being dramatic. I told her that its done between us and to pack her things and leave. I admit I was a really angry but I did end up getting a lawyer, and as I have all the receipts for all that money spent and I have her on my house's security cam footage letting the guys in and watching them take it all I think I can win. Her family and friends are absolutely blowing me up saying its just a stupid old piece of junk and that she cannot pay back all that money I spent, and that I should just let it go. But I have been putting all my time, effort, and money into that car for a year and a half now and goddammit if I am not going to get justice for what she did. AITAEdit: Thank you all so much for the support and awards and everything. I'm glad I have some people on my side. I got a call from her mom about 20 minutes ago and she told me that i was ruining her daughter's life over a stupid car. I told her she ruined her own life. I've been gathering documentation and stuff and I'm about to head down to the police station and file a report, as suggested by lots here. Once again thank you allUPDATE : went to the police station last night, was told to come back in the morning. just got back and filed an official report against her for grand larceny and grand theft auto. i showed them all the receipts i had for the car and the footage of her letting the guys come and take it as well as the title for the vehicle in my name. they said they will be in contact with all 3 parties (me, ex gf, and junkyard guys) soon and they will hopefully be able to recover some or all of the car. just have to wait nowHUGE UPDATE : THEY FOUND MY GODDAMN CAR!! the junkyard guys apparently were in the middle of hiding it when the police came to ask them questions. it was on a forklift and they were gonna put it on top of a pile of cars that was hidden behind more piles of cars. they said it was theirs and they had the title, but obviously didnt have the title for it and since they matched the vin on the chassis and body to the vin on my title, it was obviously mine. I know at least one person there has been arrested, i think he was in the camera footage i talked about earlier but idk if it was the boss or whomever or even his specific charge, they also told me they would be looking into this specific junkyard for any other vehicles reported stolen. they said they haven't been able to get in contact with my ex just yet but they're working on it. im just so glad they found my car. luckily i made quite an album of pictures detailing me tearing down the car and so i can use that to prove what parts they had were mine so i can hopefully get most or all of it back. police haven't let me take it back home yet as they say it is evidence or something so hopefully i can get it back eventually. thank you all so much for the support and advice! SHES GONNA BE ALRIGHT"
1,Not the A-hole,AITA for pretending to get fired when customers get a temper with me?,63528,e5k3z2,3663,"I am a high schooler with a weekend job at a coffee shop. My coworkers who work weekends are: James - the owners son, he goes to my school. He's a shift manager but it's not a real formal thing, he's a friendly guy.Danielle - A college student who sometimes works weekends too.So sometimes customers will come in and just be angry about such little stuff. Like literally blow up about nothing. I dunno if theyre in a bad mood already and looking for someone to take it out on or what, but it's a lot... Like how sad so your have to be to be a grown-ass man taking your anger out on high school and college kids.So James and I were joking about having a little fun with them and hopefully getting them off our backs.So one day I was at work and some guy was having a temper about how we don't make the coffee hot enough... Which I couldn't do a thing about because I gave it to him right out of the machine.So James came in and was like ""sir is there a problem here"" and the guy started ranting at him too. So he was just like ""OP, this is unacceptable, you're fired."" I started acting real sad, like ""no please don't fire me, my family needs the money, I need this job, pleaseeee"" and he played up being a hard-ass, telling me to take off my apron and leave.The angry guy started to backtrack, like ""It isn't that big of a problem, you don't need to fire her over it. I didn't mean it"" and James was like ""No, we pride ourselves on the best customer service""Of course after all that drama I still had my job, we were just acting. And we've done it a couple times, whenever a customer will lose their temper at Danielle or I, James will storm in and ""fire"" us. And almost every time, the person who had come in angry will apologise and say that they didn't mean it. It's kind of satisfying, making people realize their actions might actually have consequences. Anyway, I was telling my friends from school about this and a few of them thought it was a mean prank, to let someone go away thinking they'd gotten someone who desperately needs the money fired.AITA for this joke?"
2,Not the A-hole,AITA for punishing my son after he said something racist?,52905,iagtso,2650,"About a week ago, my (39F) family ordered Chinese food for delivery. When the delivery driver came to the door, my daughter (16F) was taking the cat upstairs to put in her room because he always tries to eat the food. My son (13M)  loudly says, “Make sure the hide the cat from the Chinese guy!” as I am at the door getting the food from the Chinese delivery driver. He very obviously heard what my son said and was upset by it. I quickly apologized and took the food. I told my son that racist jokes were completely unacceptable and very wrong and he refused to admit that he was in the wrong. So, later that night I forced my son to write a sincere apology to the delivery driver, (his name was on the receipt) as well as write a one page paper on Chinese culture and a one page paper on why racism is perpetuated by racist jokes and stereotypes. Then the next day I took him to the restaurant and had him read his apology aloud to the delivery driver as well as give him the papers he wrote. The driver was very appreciative of the apology and thanked me for making my son do it. He then told my son about multiple instances where he had faced racist comments and attacks from people while he was a delivery driver. That night my husband (43M) and I got into an argument about me making our son do this. He told me that it was embarrassing for our son to have to do the apology and that the “punishment didn’t fit the crime”. I told him that it was much more embarrassing for the driver to have to face that kind of racism and racist stereotypes and that our son would get over the embarrassment. I do not condone any kind of hateful thinking in my house, and the fact that my son said that embarrassed me as well. My husband told me that it was “just a joke” and it wasn’t that big of a deal. I feel like I might have over reacted some but I think it’s important to help my son understand how what he said was wrong and hurtful."
3,Not the A-hole,WIBTA for refusing to stop cooking bacon in my kitchen due to my teenage daughters vegan lifestyle?,51395,dkqv29,7576,"Dad here, old fart, loves his daughter to pieces but I’m struggling to see eye to eye with my teenager and wife on this one. We’ve always been a meat eating family, we live in the rural Midwest and bacon for breakfast is pretty much a given. This year my 14 y/o daughter decided to go vegan, and I jumped onto her support team with enthusiasm. We learned how to substitute ingredients, cook new things, try new things, I adjusted our budget to include more expensive vegan substitutes for her, etc. None of this has been a problem for me until recently. She saw me cook bacon in a pan, and then I rinsed it out to load in the dishwasher. She exploded in anger (teen years, I’m not too fussed about the anger explosion, I know she doesn’t mean it) and said that that was HER pan for vegan food. I was completely floored and said, kiddo this here is a family pan, older than you, it’s not YOUR pan. She asked me to purchase her a pan that she can solely use for vegan food. I didn’t want her to feel weird about food, so I said sure, and ordered her a few colored ones that are only for her. The reason they’re colored is so it helps me remember that I’m not to touch them unless I’m cooking vegan. That wasn’t good enough. Now apparently the dishwasher is ‘contaminated’ with animal product, and the fridge has ‘bacon grease fingers’ on it (because I eat bacon and then touch the fridge) and she’s asked me and her mom to completely stop eating meat at home. I don’t mean I literally touch the fridge with greasy bacon hands, because I wash my hands, but it’s clearly enough that it upsets my daughter. frankly I’m on team hell no, her mom is much more amenable and strongly wants me to consider taking our daughter up on the request. My wife’s reasoning is that both our parents live close so we can eat meat products there, and that she doesn’t want our daughter to feel uncomfortable in the kitchen. My daughter says she is fine with cheese and butter in the fridge, but it’s specifically meat products that make her feel sick. Now I’m sorry for her, but I feel like she just needs to adapt and live side by side, because I’m not going to stop eating bacon in my own house."
4,Not the A-hole,Aita for wearing the “joke” bikini my friend got me?,50961,d7yuot,4046,"So it was my birthday couple months ago. Had a party. Got some gifts. My friend “Mandy” for me a “super cute bikini”. I liked it. Said thanks. She had ripped the tags off but whatever. Anyway. Went to the community pool with my roommate. Wore bikini. Got in the water. Roommate immediately is like uhm girl.... I look and see that this bikini is now kinda see thru. Haha good joke Mandy. Anyway, Mandy invited me over to her place to hang out with her and her bf and a few others. Most leave and we’re still hanging out. I’m like hey, what if we get in your hot tub? I go change after them. And meet her bf in the hot tub she’s getting new drinks. I hop in. Immediately, he’s looking at my chest. I pretend I don’t notice and just make small talk. She comes out a few min after. And just looks in shock. Eventually gets in. “Uhh is that the one I bought?” Yeah I love it. I wear it everywhere. Make up some stuff about how I wore it to the beach, some party with lots of guys, etc. and she’s just like “oh”. We’re in the tub for 20-30. Eventually get out and change. She approached me after and was like. “Uhm I’m sorry thought you’d notice. But it goes kinda see thru”. I’m like yeah I know why’d you buy me a ducking see thru bathing suit? “She’s like it’s a joke. Wait you knew? So you just spent last 30’ flashing my bf on purpose?” I reply I’m just wearing my birthday gift from her. Anyway. Aita?"
5,Not the A-hole,AITA for telling my son he deserved his gf breaking up with him?,47776,daglhs,4019,"So my son had a long-distance gf recently for about two years. She was great, a really nice girl and we all loved her welcomed her with open arms. She was flying here constantly to visit him, like a weekend a month and he didn’t lift a finger to go visit her. I tried talking to him about it several times and told him he should really start looking into flying over to her instead of expecting her to do all the travelling. He said no. And my wife probably had something to do with it as she constantly told him she was afraid of him flying. I spoke to them both and said this girl is great for him, she was willing to move over to our country too, but said there was one condition and that was he’d have to fly over to her country too. Which is fair enough. He said no, he didn’t want to fly or travel anywhere. My son was becoming lazier and lazier, eventually telling his gf and us that he was perfectly fine never travelling anywhere including holidays etc. Last week, he told us she’s dumped him. I went on her fb page as we’re all still friends (she wrote us an apology letter about how she’s upset it didn’t work out but these things happen, so we’re on good terms) and looks like she’s with a new guy already. Me and my wife have no doubt she was seeing him whilst still in a relationship with my son. I confessed to them both that I actually agree with her decision and he should have expected it. He did not treat her properly and I hope he learns lessons for the next one because he needs to make more of an effort. I said he deserves it for his lack of effort in the relationship and for essentially just allowing this girl to spend all her money and time coming here all the time. Wife and son are very upset that I said this. Very very upset and my wife says I am being horrible. AITA? I stand by what I said."
6,Not the A-hole,AITA - Telling my parents to pay me back my college tuition if they want a relationship,47558,i9pm5u,2803,"I was raised by parents who believed (religiously and just culturally) in rigid gender roles. Dad should work, mom should stay home with the kids. I’m the only girl and have 3 brothers. Because of their expectation I’d stay home with kids, they never valued my education, educational achievements or emphasized things beyond domestic skills. I’m the second youngest. By the time I was in high school, my two older brothers had gone to the college of their choice, with my parents fully covering tuition, books, an off campus apartment and other living expenses. They eventually did the same for my younger brother. I was told I wasn’t allowed to apply for college.I did so in secret and got accepted with a partial scholarship. I didn’t tell them I was moving out until a week before I left, with essentially nothing but what a few friends gave to me that their parents bought “them” for college. I took engineering, and had to work, take on debt and struggle.My parents and I have barely spoken for years. I’m married now and expecting our first child, and they asked to meet up. We met at a park, and they said they were “sorry if they caused me pain” but would like a relationship now. I asked them specifically what they were sorry for. They wouldn’t elaborate and just said they wanted to move forward. I said that wasn’t sufficient. In the end, I said they could prove they were sorry by forwarding me the $100k my degree and college expenses were, just like they did for my brothers. My mom burst into tears, my dad said I wasn’t being serious and I just left. Since then, I’ve been getting calls from my brothers telling me I’m being immature and hurtful. I don’t think so at all."
7,Not the A-hole,AITA for sleeping naked on top of the covers to teach my flatmate's gf a lesson?,47420,d10cpy,6170,"New to reddit, please bare with. So I (21, guy) live with my childhood best friend (22, also a guy) and have done for 2 years now. Up until last week, things were perfect between us. However, he recently got a new girlfriend (23, lady) and she honestly seems absolutely great except for one thing; she seemingly has a complete aversion to knocking. She and I have quite a lot in common, and I actually like spending time with her. However it bugs the hell out of me when she just barges into my room without knocking first. Now, she's never walked in on me doing anything untoward; I'm usually just chilling on my bed or studying at my desk. However, on at least seven seperate occasions now she's done it first thing in the morning to ask if I want coffee. I sleep naked. Every time prior to the last one, I've been under the covers and she hasn't seen anything. I always point out that she *could* have and she just giggles and says ""but I didn't"". When she stayed over last week, in order to make my point, I intentionally slept on top of the covers. Sure enough, she barges in at 7AM, begins to ask if I want coffee and sees my you-know-what. She immediately backed out of the room and didn't speak to me for the rest of the day. My mate later pulled me aside and said I was bang out of order, accused me of deliberately exposing myself and pointed out that I'd ""threatened"" to do it before (I literally just said ""okay but what if I had no covers and you saw everything"" before). They're now framing this to others that I'm some sick creep who intentionally got naked and lay in wait of her because that's how I get my rocks off, and I'm kinda seeing how it came off that way. AITA for doing this?"
8,Not the A-hole,AITA for despising my mentally handicap sister?,46794,awyi8k,2723,"The title makes me sound horrible but hear me out.&#x200B;My sister is severely autistic. She requires attention almost 24/7 and cannot be left alone. She is non-verbal and cannot take care of herself at all. Despite the fact that she is only 12 she is extremely destructive and violent and destroys anything she gets her hands on.&#x200B;I hate her. That should be wrong to say but it doesn't feel like it.&#x200B;I was only 6 years old when she was born and since then i've never solely had my parents attention. Even since I can remember the world has revolved around her. I was moved out of my room into the basement at 7 because she needed to be in the room next to my parents. All of my toys as a child were destroyed by her and my parents simply ignored me when I complained. Even when I was 14 and she destroyed a mac my school gave me I was in the wrong.&#x200B;Along with this I am expected to take care of her and drop everything I do for her. I can never make plans with friend because my parents ""expect"" me to be there if they need me to take care of her. Even when I do somehow get time to myself I am required to leave if they need me. If i do not then I am punished. The recent example of this is when I went to see the new spider man movie, and was ""grounded"" because i turned my phone off in the theater.&#x200B;It seems as if I am nothing more than a slave to them and anything involving her simply overshadows me. This last week I was chosen to give a speech at a school event. I was so exited and my parents promised to be there, but they never showed and claimed it was because of my sister. Anytime anything like this happens for me they are to busy with her.&#x200B;I've held this in for so long and it finally spilled out today. While talking about colleges with my father, he joked that I should get a degree that pays well so when their gone I can take care of my sister. I don't know why but this caused me to break down. I cried and screamed about how it always about her. I'm nothing more than a caretaker to them, that they always make it about her and that I'm expected to be her ""slave"" for the rest of my life.&#x200B;I've locked myself in my room since then and my parents have not come to check on me. Am i the asshole here?&#x200B;Edit/Update kinda:Wow, thank you for all the support and love that you guys have given me. I never expected this post to reach the popularity it did. Thank you all. After thinking about it for these past hours, you are right that I don't despise my sister. It's not her fault that she was born the way she is. My parents came to talk to me a while after my break down but I was unable to bring myself to talk to them and only cried and asked them to leave. They have made arrangements with my grandfather for me to stay with him for the time being and am getting ready to go to his house. My parents want to talk to me but we have decided it's best I leave for now to have some space and time to collect myself. we will be sitting down and talking later this week about this issue. Thank you all again for the love and support through this <3&#x200B;I'll send an update your guy's way later this week if people are interested. "
9,Not the A-hole,AITA for switching to regular milk to prove my lactose intolerant roommate keeps stealing from me?,46212,hvcvtt,1429,"Me and 2 other guys share an apartment together and we split all the bills. The only thing we don’t split costs on is groceries. Everyone’s in charge of buying their own food and we don’t touch whatever doesn’t belong to us in the fridge. We put our names on everything so no one gets mixed up. This issue has been going on almost a year and I’m sick of it. One of my roommates, R, keeps stealing my food. I get home from work and containers with my leftovers are sometimes missing (they have my name written on it), or my stuff finishes too quick. My gallon of milk for example. I buy almond milk because I like the taste. But it seems to finish after a week even though I’ve only drank once or twice. I confronted R about this lots of times and that’s caused a lot of arguments. He outright denies it and tells me I’m crazy even though it’s so obvious. My other roommate and I carpool together because we both work the same early morning shifts around the same area so I know it’s not him. It’s always after we get back home and R’s already left for work that I notice my food’s gone. My roommate’s also had a similar problem but not as often as I do. I’m guessing cause R doesn’t like what he buys.The funny thing is R buys a lot for himself and is even more stingy about his food. He will literally point out what’s his when he comes back from grocery shopping and tells us not to touch it.Last week, my milk was nearly empty again and I got fed up. I went to the liquor store and bought regular dairy milk. I drank what was left of my almond milk and refilled the gallon with the one I bought. This was to catch/prove R is the one stealing since he’s lactose intolerant. The nxt day, Saturday, we get back from work and R is pissed. He yelled at me that he was stuck in the bathroom for 40 mins with diarrhea because of my milk; he was using it to make a shake. I only responded with “So then you’re the one who’s been stealing?” He freaking exploded. Yeah he admitted he was “sometimes” drinking my milk and eating my food but he was more mad that I switched milks than the fact that he was caught. I told him I wouldn’t have done that if he’d just stopped taking my stuff from the fridge or at least told the truth instead of tryna make it seem like I was making it up.My roommate backed me up and thought it was kinda funny he got payback for stealing from us. It’s a little tense rn and my roommate told me R is trying to convince him to agree to kick me out. Little does he know we’re both looking to move somewhere else together cause we are sick of his shit.  I told some buddies what happened and a few think I was an asshole for that. I feel like I’m not in the wrong here. He was taking my food and not even owning up to it and I wanted to prove it, does that make me TA?"
