,judgement,title,score,id,num_comments,body
83,Not the A-hole,AITA for suing my ex?,31490,h9emck,2625,"So I dated a YouTuber.We went out for about a year and it was alright but they were so emotionally invested in their channel that they constantly neglected me and made me feel like I wasn't a priority.Not really important why we broke up, but we broke up.Then I get a bunch of messages from friends about 3 months later telling me to go to their channel. I'm pretty much done with them but I do and I realise they made a video about me where they claim I was emotionally abusive.I continued to get messages from strangers telling me how awful a person I was and how they hoped I died through various means.So I sued my ex.It ruined them. I knew they were financially in a bad spot and they likely couldn't afford court fees but the case dragged.They made a video about not being able to afford court costs and such and how it was going to ruin them.After which a bunch of friends started telling me to just let it go and move on but I had sunk money into the case as well. It wasn't cheap for me either so I didn't just let it go.Eventually the judge ruled in my favor and I received a total of nothing from my ex......But it meant I could link to the result in the comments section of every video she tried to frame me as the bad guy because in our state, court proceedings are public record.Suddenly her viewership dropped and she blamed me for ruining her life.A bunch of my friends said I went too far and should've just taken the court win and left her alone.Was I the asshole?"
84,Not the A-hole,Aita: For giving my deceased son's college fund to his best friend instead of my nephew?,31467,jrrmdy,3384,"This has been causing a conflict with my entire family. And they think that I'm being selfish and unreasonable. Let me explain first.I M39 lost my son in 2019 due to a chronic heart condition. He was 15 years old. It was devastating and I just couldn't take it especially when my family did little to nothing to support me during these difficult times. They didn't bring my son meals when he was at the hospital. They didn't let me go home and rest even for a few hours. They didn't take care of other things while I had a lot to deal with I wasn't offered any help just words. They'd just talk but do nothing.Despite the struggle. I've created an account for my son's college fund and kept putting whatever I could get at the time and me and my son would talk about that a lot. He was depressed but always believed that he was going to get better and continue his education and attend college.I started saving money To keep him motivated and to make him feel like he could be like any other kid with hopes for a good future. He had a very close friend that's about the same age as him. They were friends for 5 years, and I can't express how his presence in my son's life helped him through the worst days, sometimes his friend would spend the night with us and try to get my son to do activities and lighten up his mood all the time. To be frank his friend was closer to him than his own family.He never stopped visiting and asking how I'm doing after my son's death. He'd show me handmade projects he made for my son and as a way to remember him and we'd sometimes just sit and talk together or cry together. Last week. While I was with my family my sister asked me what I was going to do with my son's college money. I didn't wanna mention this but since she asked I told her that I will be giving the money to my son's friend. She barely even recognized his friend and was confused and said that my nephew deserves this money since he's family. My mom agreed that I wasn't thinking straight and that I should help the people close to me-family and that my nephew has a right to go to college and I was wrong for giving this ""opportunity"" away to someone else.I didn't know what to say they kept pointing out that I was making a mistake and how my nephew will resent me if he finds out. Thing is my nephew wasn't close to my son I don't even know why he'd be bothered. My sister went on about not being able to afford my nephew's college I told her this was my decision and I felt more comfortable that way. She started lashing out, constantly texting me constantly wanting to talk to me and ending up arguing. When I snapped she had my mom calling me basically guilttripping me and telling me I'm wrong and that I needed to think about this.It's just too much pressure and I'm feeling lost and unable to figure out how to deal with this."
85,Not the A-hole,AITA for throwing out my mom after she threw out my weed?,31399,hm9j4o,2198,"Throwaway in case someone I know sees this, don't want them to know my main reddit account.So I am a 30 year old man. I'm single and live alone in a house that I own. A few months ago you know what happened and my mom lost her job. So I decided to let her stay with me.I have a medical marijuana card and smoke every day. I knew my mom disliked weed so I warned her before she moved in that I would be smoking weed daily and would not stop for her. She agreed, and only asked that I smoke outside. Which I thought was a relatively reasonable request; weed has a strong smell and many people don't like it.At first this worked out fine at first. But she started making remarks about how I should quit, ect. I mostly just ignored them/brushed them off. Then it evolved to her demanding that I quit. As if I were still  a child she could issue orders to. I refused and told her that she can move out if she doesn't like it. She started crying and saying that I don't love her, I have a problem, ect. The next day, I come home from work to find her waiting for me. She explained that she had flushed my weed (a little less than an ounce) for my own good. And then demanded that I go to treatment. Well, predictably, I was furious. And not even really about not having the weed anymore. It is pretty cheap (I usually buy ounces for $125) and I can easily get more. It was about her total lack of respect for me. I'm an adult, own my own house, have a good job, and have approval from the state to legally purchase and possess marijuana.  So someone I'm doing a huge favor for demanding that I stop and throwing out my stuff when I refused is extremely outrageous to me. No matter if she pushed me out of her vagina 30 years ago.Anyway, we argued about this for a while and it became clear to me that she was not sorry at all and that she would probably do it again. So I told her she can't live with me anymore. I gave a month, but she has already packed all her shit and drove to my brothers house a couple hours away. She obviously thinks I'm a huge asshole. So does my brother. But I think that's mostly because she is his problem now."
86,Not the A-hole,AITA for banning my husband’s female friend from our house?,31306,hkh0dd,2289,"Throwaway account, English is not my first language, I’m on mobile - I apologise. I (27F) have been married with my husband (M32) for three years and haven been dating for a little over 5. My husband has this friend (F31) ‘Mary’. They’ve known each other since they were in high school and she’s considered ‘one of the boys’, if you may. That basically means she’s always invited to all the fishing trips and stuff, which I don’t mind at all, I trust my husband. Well, my problems with Mary started when she first found out I’m half Romanian. It started kinda innocently, with her asking me to say certain words, teach her some insults etc which didn’t necessarily bother me, but it usually put me on the spot whenever we were out with my husband’s group of friends. It only escalated to her googling stuff about Romania and asking me ‘are you a vampire? do you bite your husband by the neck?’ to ‘are you a gypsy? I bet you’ve got some of that gypsy blood in you’ (which is just blatantly racist)Last week, me and my husband organised a mini BBQ with our friends and Mary was invited by my husband despite me telling him she makes me uncomfortable. He said he had talked to her about her remarks and she’s been understanding so it’s unlikely she’ll say something this time.It was midnight and there were about 4 of us left and I accidentally spilled some red wine on Mary’s jeans when I tripped over a carpet. All hell broke loose. Mary started saying that I’m a witch and I’m trying to ruin her life and this whole thing is part of my ritual and I’m just a ‘immigrant gypsy trying to ruin my husband’s life’ and I’ve poisoned my husband against her. I started crying and profusely apologising. When she wouldn’t drop it, I kicked her out and banned her from ever coming to my house again. AITA for doing this? My husband insists that Mary was just drunk and talking nonsense and he would talk to her. He also told me I’m way too sensitive about my heritage and I’m an a-hole for banning her. Mary has since given me a half hearted apology but I’m still not ok with her.EDIT: I guess this is the update some of you wanted. Sorry I’m still a mess and idk how coherent I am. We’ve talked. He admitted to being in and out of an affair with Mary in the first 2y of our relationship and she wanted to win him back I guess. I called my mom to come help me pack some stuff and im out. Thats it. Mary can have him I’ve been gaslit for years and it took a reddit post to realise. Oh the irony. thank you reddit.EDIT2 and probably the last one for a period of time: A lot of people seemed suspicious of Mary and my husband’s friendship/relationship etc and have asked if I ever suspected anything. No, I didn’t. Me and my husband had (or I thought we had) a very strong relationship, based on communication and honesty (guess it only applied to me). Also, Mary is very close with all the boys in the said friendship group. The other wives raised concerns in the past but they’ve all been shut down by the boys in the group or by Mary herself. I guess I always respected their friendship group because they were very close for so long and it felt unfair to change that because of me. As far as I’m aware, the other wives feel the same - plus Mary has been in a LD relationship for about 2 years and always claimed she’s focusing on her career, she’s too busy etc so none of us ever saw her as a potential threat. But now it just makes me think there could be more to this story. But I’m tired, as of right now, I am just exhausted. My Romanian witch blood won’t let me live until I find out the whole truth but I need time.Thank you to everyone who took the time to reply to my post, message me (even the ones that insulted me further - it was semi-funny) and thank you for the awards! I’m sending virtual hugs to all of you! Aveți grijă de voi!"
87,Not the A-hole,"AITA for disowning my brother when he came out as gay, because of how he's treating his wife?",31246,ggmc1h,1775,"I (21f) have a brother (28) who came out as gay last month. He has been married to my best friend's big sister (24) for four years, they have 2yo twin daughters together. I'm really close with her, so I've been trying to stay neutral in what has become a messy separation. My brother told his wife he's gay by sitting her down, and saying he had been sleeping with two different men for about six months. He said he is now sure that he feels romantic feelings for men, and also told her he has been sleeping with random men from Grindr for over a year behind her back. She obviously freaked out, asked him how he could do this, why didn't he tell her when he started having the feelings, etc. He said that he's always thought he was gay but he didn't want to come out because it might affect his career. She asked him what about the effect on her life? She is now a single mother to two toddlers. He was essentially very angry that she wasn't supportive of this, so he kicked her out of the house, with the kids. After she eventually found a place to stay, my brother moved in one of the men he has been having an affair with. Since then, he has had very little contact with the kids, as in speaking to them on the phone once a week maybe. He has expressed that he still doesn't want to be public about coming out, so he posted on Facebook that he has separated from his wife because they aren't in love anymore and hinted SHE was the unfaithful one (posting things like 'yeah, seems like someone in this relationship wasn't satisfied with just one man') and is basically being a dick.I told him a couple weeks ago that he's a fucking asshole and I don't want to be involved with him anymore because I think it's disgusting that he's treated his wife like this. I told him I get that you have to come out in your own time, but you don't need to kick her out, ignore your kids and berate her, and you don't need to make comments that people will assume mean she was being unfaithful (he said this was a joke about him having two partners now? still fucked up). He said I'm being a homophobic asshole, and that I don't know how hard it is to come out. He said that if I don't accept him, I'm a bigot. He made mistakes and what not. I said maybe I will forgive him if he improves his behaviour to his wife, and he said he resents her for keeping him from sleeping with men for years. I gave up at this point. My sisters (17&24) both think I'm being homophobic, my mom agrees with me. AITA?"
88,Not the A-hole,AITA for telling my boyfriend that his masculinity was fragile after he refused to buy me pads?,31205,gp0at9,1281,"Okay, throwaway because my boyfriend knows my other account. I (23f) moved in with my boyfriend (24m) of two years a couple months ago. We haven’t had any problems before this argument. Things had been going pretty well. Anyways, a couple days ago, I got my period. It came early and I had ran out of pads. I couldn’t leave to buy some because I bleed pretty heavily and I would’ve bled through my pants. So I asked my boyfriend if he could buy pads for me from the drugstore, because it was late. He immediately said no. I was shocked because I wasn’t really expecting that. I asked him why. He said that he didn’t want the cashier to see him buying pads. At this point I started laughing because that was hilarious. He wasn’t joking though. He just glared at me. I told him that the cashier would obviously know it wasn’t for him. Plus, the cashier would definitely not care what he was buying. He still refused. I told him that he could go to the self checkout machine if he was so insecure, but he said that he didn’t want anyone to see him with the pads because they’d think he was a “tr***y”. I told him that he was childish, and that his masculinity was really fragile if he couldn’t even buy pads for his own girlfriend. He got mad and went out. I had to bunch up toilet paper as a makeshift pad, wear black pants and a long cardigan and go buy the pads myself. My boyfriend has been ignoring me ever since. I’ve been thinking that maybe I might’ve pushed it too far.So AITA for telling my boyfriend that his masculinity was fragile after he refused to buy pads for me?*Edit*: *Wow, thank you for all your replies! I’m definitely going to have a serious talk with my boyfriend in the morning about this and we’ll see how it goes***UPDATE**: First off, thank you for all your awards, replies and stories, they all mean so much to me. I confronted my boyfriend an hour ago. We sat down together and I told him that I didn’t like how he acted about buying pads for me. He said that he didn’t feel like he had to, and that I could’ve “held it in” and drove to the drugstore to get the pads myself. I told him that you can’t “hold in” menstrual blood, but he insisted that I could’ve done it for a few minutes and that it wouldn’t be a big deal. We went back and forth over this so I just dropped it. I asked him (like most of you mentioned) what would happen when we have kids and he’d have to take care of me and buy me nipple cream, take me to the washroom, etc. He said that I would not need those things because I should be able to do them on my own after giving birth. He said that there wasn’t anything hard about using the bathroom and the only reason I’d need help is if I was a “cripple”. Then I asked him about the tr***y comment. He said that he didn’t understand why people would want to change the gender they were born in. That basically cemented everything for me. I felt completely betrayed and humiliated. I can’t believe I spent two years of my life with a guy who holds these views, and I can’t believe I was too oblivious to it. I just feel so dumb. I told him that we need to break up. He cussed at me and told me that I was exaggerating and that I was being a bitch. I told him that I would send him my half of this month’s rent (we live together but it was his appartement so we would split the bill). Then I packed my bags and drove to my parents house without saying another word. I’m gonna be staying with my parents until I sort myself out. I’m feeling really down right now, because I really did love him, but I also feel relieved. Again, thank you all for helping me out, and sending me encouraging messages. I appreciate it all."
89,Not the A-hole,AITA for telling the principal that his punishment was dumb and taking my daughter out for a fun day instead,31095,ipw5v4,1882,"This happened last year before the world fell apart, just asking out of boredom.My daughter was in second grade. She was in class and suddenly felt like she was going to vomit so she tried to run to the bathroom. She didn’t make it and vomited in the hallway. However she was sent to the office for running out of class without permission. The principal called me about this and I had to come in. He told me that she was being punished and was losing her privileges to go on the field trip the next week. I told him that was insane considering she did it because she was trying to keep from making a mess and she’s 7! She made a snap judgement that I think most people would make. On top of that, they sent her to the principal instead of the nurse. He refused to change the decision so I took my daughter out of school for the last 2 days of the week. Since she was missing the field trip I wanted her to have as much fun as possible so we went to an amusement park, the movies, and to paint pottery. She told her father about this during his visitation time and he got very angry at me for undermining the principal. AITA?"
90,Not the A-hole,AITA for making fun of a girl for her dad's 9/11 death?,31046,iqyn74,946,"I go to college in New York state. I am Muslim. I was very young when 9/11 happened, as were the rest of the people in my year.There's a girl in one of my classes who's father was in the World Trade Center. He died. Of course, this is very sad, and I pity the man, but not her. She's extremely racist. She hates everyone who isn't white or east asian. But she especially hates Muslims due to her father's passing. So of course, we don't talk.But today, September 11, was the day she exploded. I was wearing a hijab. She told me I should take it off out of respect for the victims and that it was the equivalent of a hat. I said no. She said that ""you Muslims did this, you need to take off the hijab to show respect."" I obviously told her no. Then she went on a very long Islamophobic rant that I can't entirely recall because this was hours ago. But I remember she concluded by saying that Islam took away her father, so she wants to take away Islam. (I'm still confused as to what she meant.)She made a few comments towards me, and I went on my phone to de escalate. She made more comments, I kept ignoring her. But then she said ""Yeah, you're not responding because you know I'm right"". I don't know why that set me off, but it did. I told her ""No, I'm just busy texting my DAD"". She left the room in tears. My classmates are saying that she was in the wrong, but what I said was unnecessarily cruel. Now, I don't think I'm TA, bc she started it, all I did was finish it.So, reddit, AITA??Yes, I am aware I have spelling mistakes. I speak Arabic at home.EDIT: For everyone wondering, the professor was out of the room. He'd already given us our lecture."
91,Not the A-hole,AITA for being honest about how I was bullied and how the teachers at my school did nothing about it while being interviewed by a current student?,31046,lb4bjq,2133,"I’m an author of mild success. I’m not incredibly popular, but my books sell enough. About 3 months ago, someone from my old high school reached out to see if a student could interview me.I responded that my time at the school wasn’t the happiest, but I would give the student responses relating to my career. We had a great chat. She started asking questions about my time at the school, but I redirected. She caught on to what I was doing and asked “I’m sensing that you’re hesitant to talk about your time at (school). Is that true?”I said let’s focus on the story, and she was like “Actually this could be a better story.”So I said y’know what, sure. Whatever. I don’t owe the school anything, I’m not being paid, and even though it’s been a long time and I’ve grown from what happened, it’s still worth talking about. I mentioned a few names in specific, and how I’d tried to ask for help and was blown off by everyone. Teachers at my school very strongly favored the girls in sports teams, and would often be buddy buddy with them and their parents.I mentioned a teacher who openly mocked the way I dressed, my lack of athleticism, etc. I brought up the time that a group of girls followed me around the school mooing at me and when I broke down crying because they wouldn’t stop and tried to tell a teacher, the teacher called me “Moolly” for the rest of the year and when I yelled “MY NAME IS MOLLY. *MOLLY”* she had me suspended for a week.She ended up publishing the whole interview. Nothing exactly went “viral” but there were posts on FB with a ton of comments and it caused some commotion in that community.A few weeks later, I was contacted by a school official who chastised me for bringing up old wounds and trying to paint veteran teachers as bad people when they were going through difficult times already. The teacher responsible for the “Moolly” incident had a local lifetime teaching award taken away from her after it all came out, so was it really worth it, and maybe did I remember things wrong?Finally, a handful of my old classmates (many of them stuck around town) found me and I was barraged with a ton of messages telling me that I’m ruining the reputation of the school and of several prominent community members, it was X years ago so why can’t I just get over it, etc. Some of them obviously haven’t changed.It was a long time ago, yes. I don’t know how I really feel about how this all went down though. I know times are tough for teachers right now. I didn’t set out to hurt anyone, I was just telling my truth. AITA?**Edited:** So... I didn't expect this to be so overwhelmingly in favor of NTA. I wasn't looking for validation, but wow. Some of you are sending me heartbreaking stories of bullying and being ignored or gaslit, and I am so sorry. Thank you all for the responses. If the Mods want to take this down because of validation or whatever, please do. I have my answer. "
