,judgement,title,score,id,num_comments,body
10,Everyone Sucks,AITA for getting upset with my best friend because he ignores me and flakes on me when he's with her gf?,3,m1g2iq,20,"Throwaway account, anyway let's get straight to the point.My male best friend is in a long term relationship of 6 years. Now, bear in mind, this is one of those very unbalanced relationships where they do love each other a lot but he loves her WAY MORE than she does. She's at the very first place in his life and he would do anything for her. To give you an idea, he'd instantly leave anything he's doing in order to satisfy her needs of the moment. He multiple times flaked on work trips because she admittedly ""wanted company"" before her uni deadline.Now, you can wonder how frequently I get flaked or ignored with the most bland excuses which I obviously know are meant to hide the fact that she probably just doesn't want to hang out (she's the laziest person I've met in my life and also very cheap). This also extends to texts and calls: if he's with her then he's off limits basically, at her majesty's service, not able to answer a simple text or a call. Viceversa, if I'm with him and she calls then run for your lives! He can even stay at the phone for half an hour while we're taking a walk just because she wanted to chat.AITA for getting upset by this behavior?They recently both helped me a lot during an emotionally hard time of my life and are both in general great friends to me and for this reason I tend to justify this behavior, feeling I shouldn't get upset just because they were there when I needed them."
11,Everyone Sucks,AITA for insulting my SIL after years of holding my tongue?,3555,m0b436,1067,"My SIL is low class. I really have no better way of putting it. She has a 10th grade education, thinks she is smarter than everyone else, and brags to make herself seem like more than she is. At her core, she's white trash, plain and simple. My brother is the only reason she's not living in a trailer right now.  She will bluntly talk about her sex life, about things she's done, and shit that nobody really wants to hear. She'll also openly insult me and I'm told by my parents to just accept it and not make waves with my brother. For eight years, I've tolerated her on the basis that she makes my brother happy.  This weekend, we were all together and she began talking about how my brother is a blanket hog. My fiance laughed and admitted that she was the blanket hog when we shared a bed and I never woke her up to get them back.  SIL responded that she would wake my brother out of a sound sleep to get the blankets back, and that once he was awake he'd be looking for something else. She then stated that I knew better than to wake my fiance up, because I obviously didn't have my A game at that time. These feral comments are typical of the type of thing she typically says.  I replied, ""I can make due with the sheet and light blanket. I don't need to disturb her sleep when she gets up so early."" She laughed, ""I'm just saying, don't wake us up if you don't have the game to back it up!""  My fiance was a virgin when we got together. This is not well known as it's really nobody's business but hers. At this point, I'd had a few drinks, and I was feeling a bit prickish.  I smiled and replied, ""I can confidently say I am the best that my fiance has ever had in her life.""  SIL rolled her eyes, looked at my fiance and asked, ""Really? I mean, I know you have you stroke his ego, but really?""  My fiance laughed, ""Well, actually he's right. He is definitely the best I've ever had, and that's not an exaggeration.""  SIL shook her head, ""In your whole life? Be honest. Woman to woman, who's the best?""  My fiance admitted, ""He's my first, best, and only.""  SIL laughed, ""Wow! Seriously? You gotta put some miles on those tires before deciding on the best.""  I interjected, ""Well, when you buy a new model right off the floor as opposed to a used up beater, you don't have to worry about who's been inside of it before you.""  Note: I do not think of women like this. I love and value my fiance no matter what, and I drunkenly attempted to flip her own metaphor back on my SIL.  SIL became very quiet and they left shortly after. My brother told me that my SIL is very upset with me and says I called her a whore. I told him that I'd been holding my tongue for a decade for his benefit and I was done putting up with her.  I regret saying it, mainly because of the sexist implication and being drunk, but I stand by shutting down that line of conversation. AITA?"
12,Everyone Sucks,AITA: For Not Giving My Friend Answers?,5,m1bu2l,8,"For context: I'm one of the top 3 in my class So, this story is fairly recent. I go to a private school, and we have midterms, and on midterms especially online exams, I and a couple other friends usually work together.  Then, comes friend A, he isn't in my group, and we didn't make any promises before, and he usually doesn't help me either. Social exams came up, and I really can't concentrate, because besides my group trying to get answers, and my other friend trying to get my answer (we made a pact), I forgot to give friend A my answers. So, I told him, just to do it by himself.   It occured to me that I finished 2 minutes before the deadline, and so did my group and my other friend, but I forgot about friend A, and didn't give him answers, so he ran out of time. I don't know for sure if he managed to do it on time or not, but based on our chat, I assume he didn't.AITA for not giving him the answers?"
13,Everyone Sucks,AITA for getting a room every beach house visit because of having kids?,860,m0fbk8,355,"First, using a throwaway, also non native English speaker so I apologize in advance for any mistakes. On mobile. So this is a conflict going back about 8 years that just flared up again. My parents (f65) and (m68) have a beach house with 3 bedrooms. The smallest is theirs and have only a double bed, the other two rooms are a bit bigger and they each have one double bed and a bunk bed, so sleeping room for 4 people. When me (f29) and my siblings Adam (m32), Eric (m27) and Sara (f25) were kids we would have one room for me and my sister and one for my brothers. When we got older and got partners we started a rotation system so that two couples would share a room while one couple got a room for themselves and the last couple would sleep on the pullout sofa in the livingroom. Its important to note that this is what we all wanted as then we would all get one stay in every 3 to have some privacy.This system worked great until 8 years ago when Adam and his wife got a baby boy, and whenever we stayed at the beach house they would get a room for themself, for obvious reasons. So then the remaining couples would rotate between the last room and the livingroom and no one got a room all alone. Then I got pregnant with twins, they're now 6, and so me and my husband and the twins would use the other room and the two last couples would sleep in the livingroom, one on the couch and the other on campingbeds. Since then Adam and his wife has gotten another boy, now 4, and I have a 3 year old girl. Obviously this didn't make Eric and Sara too happy, but Eric and his girlfriend was understanding, Sara was not. She was pretty upset and would argue about this every time, and we all understood she was upset so we tried suggesting things like not all of us going at the same time but she didn't want that, she wanted everyone there like we have always done, we tried suggesting renting a camper or somthing like that but again she refused. She only wanted a private room every 3 trips. Which again is understandable but babies need more sleep than adults and having them sleep in the livingroom would mean it would have to be quiet there from like 7 and that wasn't an option either. Anyway, when my youngest turned 2 we, that would be me, husband, Adam and his wife, started having all the kids in one room and rotating one of the four of us sleeping there too. The rest would sleep in the livingroom and let Eric and his girlfriend and Sara and her boyfriend have the other room every other visit. That worked great up until now, when Eric just announced that they are expecting a baby in september and Sara lost it. She screamed and cursed and accused us all activly keeping her from ever getting a fair share of the rooms and it was so unfair of us to be getting rooms just because we have kids. This went on for days and shes still pissed and the rest of us are really starting to feel awful. Are we the assholes here?Edit: I realise I need to clarify some things. 1) Like I said the last year things have been going great because my sister has been getting a room. The problem arises again noe because my other brother is having a baby, and this summer he and his girlfriend got into the whole sleeping in a hammock outside thing, and obviously can't do that with a baby. 2) the situation with all of us up there only happens in the summer, usually for one week and one weekend a month or so later. This is where things went well last summer because my sister got a room and my brother slept in his hammock. 3) the rest of the year they usually invite us two siblings at a time, so each family gets a room. Usually 6 weekends a year. The problem here is that my sister shows up on the weekends me and my brother are invited, because she doesn't want to be left out as she says. 4) my parents won't sell the house as its annold familyhouse. Me and my husband is looking for houses nearby to buy but its going slow, seeing as theres not a lot of houses around. Its a bit remote. 5) the nearest hotel is 35 minutes away. Again, kinda remote place. Thats why we don't stay there. Hence the camper suggestion."
14,Everyone Sucks,AITA for staying out of my friends' drama?,4,m1c28e,7,"Sorry this is long, but I've always felt a little guilty about this and I wanted to get reddit's opinion.Back in grad school, two of my friends were F and J, both late 20's/F. F and J were really close, they had kind of a big-sister (J) little-sister (F) relationship, I even think that J took F on a trip abroad with her family. J was super smart, really pretty and sweet but kinda nerdy, would crack jokes that only she would laugh at, that kind of thing. F's a spitfire, tiny and cute and got away with a lot.A few years before this situation happened, F started dating R. He was like the human equivalent of a golden retriever, funny, kind of a jock, head over heels for F. She loved him but was could be super insecure, which is weird because R was so crazy about her. This becomes relevant later.About halfway through the year, J called me and F and asked us to come over. She told us that she was leaving the program, which we were totally caught off guard by. J didn't go into details but I think it was something mental health related, maybe depression. She had a few months to wrap up things at school and then she was out. F was really upset at first, but then I started noticing that her attitude toward J seemed to be changing. She kept talking about how she was shocked that J was leaving, maybe she didn't know J at all, etc. F also started saying that J was acting flirtatiously towards R I was  confused because J was pretty affectionate and huggy but I had never seen her be inappropriate, but F told me that J had once been ""the other woman"" in a relationship and so she couldn't trust her. F refused to talk to J about this because she didn't want to mess up her last few months at the program, and J seemed totally oblivious to her feelings. It was really awkward for me because I liked them both but was a lot closer to F, and I felt like I couldn't say anything. R thought F  was crazy but also didn't talk to J about it. So finally J moved back home, and a few days later F confronted her on the phone. They ended up having a really big argument and their friendship pretty much exploded. Here's where I think I might be the AH: J reached out to me a few days after their argument wanting to know why M thought this about her, basically begging me to explain it to her. I honestly didn't know what to say so I just didn't answer. About a week after that, J reached out again with another long text just basically saying that she hoped I'd talk to her. At this point, I really just wanted to stay out of the whole M/J drama so I didn't respond. I liked J a lot but I had to still be at the program with F for another few years, and I didn't see how I could really help J anyways. So, reddit, AITA? It wasn't my proudest moment but I think it was understandable given my friendship with F."
15,Everyone Sucks,AITA for asking for my money back?,4,m16dbb,58,"First of all, English is my second language, so sorry for misspellings or mistakes. Also I'm on my phone. The story is this: two years ago me (F23) and my best friend (F22) rented an apartment, she was supposed to pay rent and I'd pay the bills, and then we'd give eachother the correspondent money. On the apartment also lived her boyfriend (M24) and a friend of theirs (F26). Her boyfriend at the beginning lived with us because that way we could split everything in 4 and pay less, we didn't plan this at the beginning, but it was his decision. He didn't have a permanent job so he had money coming but not as much as my friend and me. Their friend said she would be putting less money because she didn't have a permanent job either, and she was giving what she could to my best friend to pay rent. No problem here in theory. The issue is that on the first few months the boyfriend offered to carry the counting of the numbers of the house (rent and bills) , but he never did. He also never paid me anything, and neither did the others. At one point he said we didn't want to live with us anymore, so we excluded him and divided everything between 3. But he was still living with us everyday, eating, showering, sleeping, “because he was my best friend's boyfriend.“I paid my part of the rent every month and I carried all the bills, so I was living paycheck to paycheck, I never could save some money or sometimes even buy food. This carried on until I decided to move again with my parents.When I started demanding my money back the boyfriend owed me like 300€, but the others owed me around 600€ each. The boyfriend said that he owed me nothing because he was living with us ""as a favour"", and my friend said I owed her money because she counted some amount that I owed her long before living together (300€), plus an amount that she was overpaying of the first few months of rent because her boyfriend did the numbers wrong, so I owed her my part. At the end, both girls owed me around 1000€ each and the boyfriend 300€ with the ""discount"".Now, I think she shouldn't have mixed the money I owed her before living together. I was only asking for the billing money, and we both did things for eachother for years. Without the money I owed, the numbers said that she owed me, but she doesn't want to hear it. The boyfriend should pay me what he owes from the months he was officially living with us at least, I was not even asking him to pay for the two whole years, but he decided to pay me nothing ""because it was a favour""And their friend blocked me everywhere when I asked for her part. No excuses. I even told her that she could give me like 20€ a month so it wasn't so hard for her to give it back. No response. So I am around 2300€ poorer and they treat me as a traitor for leaving them to pay for everything and leaving the house with a two week warning. AITA for asking for my money back?"
16,Everyone Sucks,AITA for Telling my Fiancé that His Best Friend Invited a “FWB” to a Party This Weekend?,38,m0ux10,19,"My (24f) fiancé Joe (24m) has been friends with “Ben” (25m) since they were in elementary school. Ben recently got out of a shitty relationship, and ended up replying to a Snapchat I had of a “girls night out” picture of my friend, Jess (23f), on my Snapchat story. He asked me for her Snapchat, so after checking with my fiancé to see if he’d be okay with me getting two of our friends together, and asking if she was good with it, I sent him her snap. This was about two months ago now, I guess they’ve been talking a lot and some pictures were exchanged, so it’s kinda a FWB situation. Joe and I, along with a couple of our good friends, decided to have a little outdoor party (12 people) now that the weather is nice and the majority of our friend group is vaccinated (most of us are doctoral students and work in healthcare). We decide to have it at Joe’s house that he rents with his friends Mike and Kevin, since they have a big yard and some guest rooms.  My fiancé hasn’t seen Ben in a while, and invited him to come, and the other guys were fine with him staying on a couch (other guest rooms were claimed, since we don’t want people to drive after drinking). Jess is  roommates with another friend of mine who isn’t on good terms with my fiancé right now, but they’re usually a “package deal”, and since I didn’t want to deal with any drama I just didn’t tell her about the party. Fast forward to today. I was meeting with Jess and some other friends to study and she mentions to me that Ben invited her to “a party that my fiancé and I were having this weekend”, and he had invited her to spend the night for the party. She also mentioned this in front of the friend who I was trying not to invite because I didn’t want to have to do damage control. It ended up being kinda messy, and my other friend isn’t talking to me or Jess now.So I texted my fiancé and told him what was going on, and asked if he knew Ben has invited one of my friends. Apparently Ben hadn’t asked, and my fiancé was pissed. Not only because his friend hadn’t asked permission to invite someone to the party, but he had put me in a really awkward situation I had been trying to avoid with my friends (not that he knew, but still), and was presumably going to try to get laid on my fiancé’s couch. Ben ended up texting me and was really upset that I hadn’t just reached out to him to ask about it, since my fiancé is has apparently told him to not come to the party this weekend. So AITA for telling my fiancé that his friend invited his FWB to a party without asking?"
17,Everyone Sucks,AITA for being ungrateful on my birthday?,13,m0ywlv,37,"preface: I live abroad and have only one friend that I see other than my boyfriend whom I live with. I do not physically socialize with anybody else at all. I see her every day at the gym, but we’ve only known each other a few months. Our friendship got very intense very quickly. It was my (28f) birthday this past Friday. My boyfriend dropped the idea of spending the weekend at a city we live an hour from. We found a dog boarder and I was excited to go away with him & chill without thinking of school, work, the dogs etc. He booked this fancy hotel, which shocked me cause we’re usually cheap as shit but I was impressed he’d booked such a place. I assumed the plan was just to go there, explore the city, grab dinner & drinks and chill then head home the next day. When my family asked my birthday plans, that is what I told them. Basically expressing it as a romantic weekend getaway. I’ve been extraordinarily stressed lately, what with covid, being 4000 miles from my family, upcoming exams and visa stress, I was looking forward to the time away. On Friday my boyfriend “ruined the surprise” by telling me my friend had planned to surprise me by coming along too. This had me pissed and upset. He then said she’d planned to buy me other surprise gifts too. I think I might be the asshole because I burst into tears and completely locked my friend out. I hadn’t even spoken to her but she suddenly texted me saying she knew the surprise was ruined and did I think she’d be a third wheel if she came. I was completely thrown because it was literally seconds after my boyfriend had told me and I guess he’d text her straight away. Before I had a chance to process my change of plans she was asking me to choose between the plans I didnt even know where happening and what I thought was happening. I just shut down completely. The day we were due to go away, she came and dropped off her “surprise gifts” (bearing in mind she’d already given me a gift in the week): 4 dresses, a full spa kit, a PhotoFrame, a shit ton of drinks, and 3(!) extra birthday cards and A homemade cake I’d asked my boyfriend to make AND a bouquet of flowers was delivered on my bday too. I was very unresponsive opening the gifts and felt guilty that I didn’t show more of a reaction but I was so upset and overwhelmed that I didn’t know what to think. Eventually I told my boyfriend to cancel the hotel, where I found he’d booked 2x $350 rooms (one for our friend and one for us) which I was angry at because it’s too much money. I ended up spending my birthday weekend in tears and angry at myself and everyone and have basically ignored my friend who spent way too much money on me. AITA for being ungrateful for her gifts and effort when I ruined the surprise they’d planned?"
18,Everyone Sucks,AITA for defending my husband?,9,m10nt0,17,"So first some necessary pretext I am new to this so please don't harp on me. English IS my first language.     Cast:Me: Me (25, ftm Trans)Husband: Moonie (25, ftm Trans)GM: Grandma (60+)EG: Entited Grandpa.(60+)Because of Covid my husband lost his job which forced us here.However, these people are extremely toxic. Anytime at dinner they make fat jokes. Anytime he helps? They tend find one single flaw- and tell him how shitty of a person he is. Anytime anything goes wrong- blame automatically goes to US.They refuse to call us by correct names/gender.Yesterday EG called and cursed at him for accidentally spilling boiling tea in the sink. I watched tears come from husband. If they said something about it by the time we got home (which FYI we were both DREADING), I would say something. I told my husband this and he agreed.Well it happened. I honestly don't remember much of the conversation, But I know it went something along the lines of:Me: Mistakes \*\*happen\*\* we are human! Moonie is trying his hardest to do the best he can!Grandma: Well he still left a mess! He could have come to me, and I would have helped! He needs to LEARN.Me: He doesn't COME to you because you always get onto him and nag him and tell him he never does anything right!Grandma: Well, he NEEDS to learn! It's been like this since I've raised her-Me: he's not a CHILD anymore! He has gotten better- I would know being his husband and living side by side with him. He. Is . Trying!Grandma: LISTEN, THIS IS MY HOUSE. MY DAMN RULES. HE WILL ABIDE BY MY DAMN RULES-Me: YOU BET WE DOGrandma: YOU WILL ABIDE BY MY RULESME: YOU BET \*I\* DO! THIS is why Moonie is the way he is, it's because of YOU and how you NEVER tell him you love him, how you NEVER tell him he is doing a good job, how you never give him anything positive!Grandma: \*says something here that again, I don't quite remember but leads me to saying\*Me: Well DON'T YOU WORRY, We are trying our DAMNDEST to get a place to get away from here and out of your hair!Grandma: GOOD! DON'T PLAN ON COMING BACK!Me: OH WE DON'T BELIEVE YOU ME!Grandma: GOOD! CAUSE WE'D PREFER IF YOU DIDN'T EVER!Me: WE WON'T!Grandma: GOOD!My husband knows I DON'T do confrontation, it causes me to go into an extreme panic attack. This was all new to me, I was SO scared, and standing alone trying to defend my husband.Then... he told me something I never thought I'd ever hear from him-  Husband: You're always on such a high horse, you never know when to back down, you get so high up there when you're like this. You never know when to stop.Me: ...So, you aren't appreciative?Husband: Yes and no. Mostly no. I told you to just ignore them, you could have just let it go.And to be honest? I don't remember what he said after that.  I told him for the time being I had nothing else to say to him until further notice- I even took off my ring tonight.However, I can't help but wonder, AITA?"
