,judgement,title,score,id,num_comments,body
19,Everyone Sucks,AITA for getting mad at my sister because she ignored my texts for over a week?,12,m0ss8o,25,"My (15F) sister (17F) doesn’t live with me and I don’t get to see her often except for holidays. We keep in touch often via texting and phone calls, and we have a good relationship. Recently she stopped texting me as often, and I’m aware she’s someone who really needs a lot of ‘me’ time so I’ve always tried to give her some space. (I like to think I’m not a clingy person? But I really need to constantly just have someone to chat with) A couple weeks ago she somehow let it slip in conversation that she “tolerates me” when I talk to her. I was stunned and she followed that up with an explanation that I’m too energetic for her sometimes and I suck up her patience like an “energy vampire.” I was kinda hurt by what she said, but she apologized profusely and said she didn’t mean it like that, so I didn’t think much of it. A few days after that conversation took place, I shot her a random text about something, and she didn’t respond to it for 3 days. I just assumed it was another one of those days where she needed some alone time, but 3 days turned into 6 days and she’s never ignored me for that long before. I started getting worried and I shot her texts asking if she okay. She never responded and that’s when I seriously started to think something was wrong. When 6 days turned into 12 days, I even called our grandmother to ask if she’s heard from my sister in the last week, and she said no. I texted a gc that my sister and our mutual friends are in to see if any of them had heard from her, and they said no. After about 10 minutes of texting in the gc, my sister popped in and said “I could’ve gone longer than that if y’all didn’t bother me.” Here’s where I may be TA. I told her that she’s fucking insane for not giving a quick reply to me when it’s clear from my multiple texts to her over the last 12 days that I’m worried about her. She said I’m overreacting and that I’m “clingy like a fucking leech.” She told me I’m making this way too big of a deal when it doesn’t need to be, and honestly I think I may have overreacted too, but I was just rly pissed off at the time. AITA?"
20,Everyone Sucks,AITA for telling my bf the his sister's new bf is coming on a family vacation.,15,m0pnw1,34,"Obligatory mobile. I'll try to keep this brief. I (25f) have been dating T (25m) for almost three years, we live together have a dog plan to get married all that. T had a sister named G (22 f) who I was kind of close with. G broke up with her ex a month or so ago. She admitted to cheating with her now bf (21 m). It should be noted that G has a better relationship with me than she does T. Lots of stuff growing up thats too long to post here. G has also caused quite a few issues in the past. We are still friends with ex because he was our friend. We don't talk about G or her new bf or anything with ex. G does not like that we are still friends and we have explained to her why and told her that frankly she's just going to have to deal with it because while we don't agree with what she did she's still family. Fast forward to yesterday. We have met new bf and he is ok, he's younger than us and we don't have much in common but no official opinion. T and G's parents invited us on a vacation in August. G told me yesterday while we were having out that new bf was invited. I was like ok cool whatever. Here is where I may be the AH, I was texting T while I was out with her and told him that new bf was invited. I just said ""hey new bf is coming"" and that was it.  He flipped out. He called his parents in a rage. I knew new bf wasn't his favorite but I had absolutly no idea that he was going to react like that. The short of it is that his parents flipped and then his mom started accusing me of being phony and saying nasty things about me all to him, never once coming to me and asking me about any of it. His sister then this am sends texts once again attacking me and saying she's done with T and I. I sent a message back saying that I'm sorry, it was not my intention at all and I'm not trying to be two faced and thay I didn't know T was going to react like that.  She knew that I didn't have an opinion on new bf because I just don't know him well enough yet. Their mom apologized to me after hearing my side of the story and I sent a long text to G apologizing again and trying to explain. So reddit,AITA?"
21,Everyone Sucks,AITA for throwing out my home cooked meal?,1257,lzs1z5,504,"I (F19) have been dating ""Matt"" (M21) for around 7 months now. We decided it would be fun to host a dinner party with some of our friends. For some context, Matt is Indian and most of the friends we invited were his friends and also Indian (this will be important later). I had planned on doing most of the cooking for this party, which I didn't really mind because I got to call my mom to go over recipes and stuff. So, fast forward to the Sunday of the party. I was cooking all my family's Jewish af recipes (brisket, matzo ball soup, etc...) Matt came into the kitchen when I was almost done, and he said something to the effect of, ""well, if we get married, you'll have to start cooking my cultural food and not just yours."" I took offense to this because I feel like I should be able to cook whatever the fuck I want to cook when I'm the one cooking. If he wanted biryani or something, he could've cooked it himself, right? I have, in the past, cooked traditional Indian food (it didn't really turn out, but it's the thought that counts). I feel as though I overreacted a little because I took the pan I was holding (the soup) and just threw it away. He didn't take that well. AITA?"
22,Everyone Sucks,AITA for telling obnoxious girl to stop making everything about herself.,10,m0j4ws,17,"So basically I have a friend group and we let the annoying girl tag along because we feel bad for her.Unfortunately a friend has a pet that was missing at the moment (he luckily found his cat later). He was very sad and seemed on the verge of tears. Annoying girl then interjected with her story about her dog being missing when she was seven!? Then she started crying. It was so forced everyone in the vicinity looked over and cringed.After she finally forced a tear down her cheek she dramatically wiped off her singular tear. Since we all know she loved pulling this BS all the time we just continued talking.She interjected a final time when she coincidentally had a pet go missing today... which was confusing since why would she not tell us that story first?My friends and I just kinda looked at her and I told her to ""stop making everything about yourself, and this very clearly didn't happen"".She actually started crying when we called her out and she ran into the bathroom. Since one of my friends has her mom's phone number he called her later that day to inquire about the missing pet.Lo and behold she didn't know what her annoying ass daughter was talking about. We're not gonna cut her off just yet because we kinda found it amusing but she texted me later that day calling me TA.She said: ""I was just trying to make him feel as if he wasn't alone and had someone to lean on, YOU shouldn't have made everything about yourself."" I didn't text back but did show the screenshot to my friends.Edit: I may be TA for causing a scene when I could've not responded to her BS. I also may be TA as she may have some issues with attention seeking."
23,Everyone Sucks,"AITA for ""taking in"" a pregnant dog that my brother abandoned a day before it gave birth, and as a result my roommate has to unexpectedly deal with the dog and puppies?",725,lzq64h,347,"My (25M) brother (30M) is a drug-addict who always ditches his pets with family members when they get too troublesome he's never done it to me before, tho. Roommate and I live in a 2-bed that's not really suitable for pets. Tuesday - my brother drops by expectedly with his dog, and ditched the dog with me. I don't have pets, I argued with him but he just goes. It was 20:00 at this point I had no idea she was pregnant so I said I'd look after her for a day. The dog was relatively friendly and my housemate was out of town until Thursday so I figured I could just deal for 1 nite. Dog gave birth to nine puppies over the next night. Completely shocked. it was horrendous I woke up to an extremely upset dog, screaming puppies, blood all over the place from the birth. I called a bunch of places but they all said they wouldn't take a dog in active labour.I did my best with the puppies after googling what kind of nest (?) I should build. puppies are so useless they can't even regulate their own body temourature. I had to spend nearly 100 dollars on lamps, blankets, rugs, etc. plus time I spent cleaning and disinfecting from the fucking crime scene that the birth caused.I am NOT a dog person. There is dog shit everywhere and my house smells like TEN FUCKING DOGS ALL THE TIME and the puppies **constantly** scream. They do not stop screaming. I have been taking time off from because according to the internet, there's a chance the mom-dog will eat some of the puppies if we leave her alone?? This absolute monstrosity of the animal The mother dog is constantly hungry (obviously from having to tit-feed nine fucking puppies) so I a buying food for her.Roommate came back on Thursday, immediately went insane. Told him that I had not planned this but it didnt help. I told him I also want dogs gone and what had happened. He made ultimatums for me to kick the dogs out onto the street if I can't find a shelter TODAY. I have asked him what right he has to be so angry at ME (rather than my brother, or at least at the dog for having so many fucking puppies) and he says* I shouldn't have let my brother in the house if he's done this before (?)* I should have known the dog was pregnant or asked my brother if the dog was pregnant (who asks that?)* I shouldn't have let the dog stay for even one nightHe won't stop cursing me out every time we cross paths. Every night if he gets woken up by the puppies weird screaming noises, he knocks on my door and demands I ""shut them up"" . If there's any shit anywhere in the house he grabs it with a hand towel and smears on my door/near the entry to my bedroom saying it's ""my mess"".AITA here reddit?And as a side note - what the FUCK am I supposed to do with this many dogsUPDATE: I am having a foster parent pick up the mother dog and puppies tonight, they are driving from a few counties over so it will be a few hours from now. All puppies still seem healthy. The shelter sent me  their credentials so they seem legit.I threatened to call the police on my roommate if he kept yelling at me and putting shit on my walls and door. He is going to stay with his girlfriend but he is packing up all his stuff so I assume he isn’t coming back. I don’t really care if he keeps paying rent."
24,Everyone Sucks,AITA for backing out of a vacation with friends?,154,lzz24o,82,"I have a group of friends that consists of 4 married couples. I am the only single person in the group.  We recently decided to Airbnb a vacation house together and one of my friends (Brandon) did the legwork to find and pay for the house upfront. The house chosen had 5 bedrooms, one for each couple and one for me as a sole occupant. The total bill would be $2000 for the entire trip. Brandon ended up saying I owed $400 for my portion. ($2000/5 rooms). I was taken aback, thinking that it should be per person and that my portion should be around $222 ($2000/9 people). His argument was it was a per room price, like a hotel. I countered stating we didn’t rent just rooms,  we rented an entire house that everyone occupied, used, and enjoyed. Why should I have to pay nearly double of everyone else just because I am single? I said I wouldn’t be going and Brandon was pissed, because he lost the deposit due to cancellation. AITA for backing out, not wanting to pay double what everyone else paid?"
25,Everyone Sucks,AITA for yelling at my sister?,23,m07t9t,31,"(17F) I suffer from severe schizophrenia and OCD. Mostly my family is respectful of this except for my little sister, (15F), who is a nightmare to live with.I love my little sister but she never respects me or my disability, and I don't ask a lot of her.I'm VERY food oriented. I plan out my meals days in advance. I also am incredibly routine oriented and can only sit in certain seats at the table for dinner or in the car.I had planned to have a muffin this morning and I had one the previous morning (4 in a carton) and got up and we were completely out. I was incredibly upset by this which seems very ridiculous and I can understand why people would laugh at that but for me it's very upsetting to have my routine or plans thrown off even slightly and I asked my sister politely if she ate it.She ate 2 of the muffins and me and my brother each had one. We ended up arguing. I was willing to let it go but this happens frequent enough to be an issue and I tried to be as polite as possible about it but she kept resorting to name-calling. I brought up other facts including thatA. When my cousin lied about me and said incredibly horrible things about me, my sister tried to make plans to hang out with her the next day.B. I always knock and ask if I can enter her room. She does not do this for me and will not leave when asked, even when on call with friends. C. If I'm doing work, she'll find a reason to use the master bathroom. Even though we have 2 other bathrooms she will complain whenever I ask her to leave.My parents have this sort of idea that since we're practically adults we can sort things out ourselves but will also take sides in arguments they weren't a part of or mediate things. She steals from me and blames it on my schizophrenia for not remembering lending her $50 in paints that she proceeded to lose and not return or pay for, when I know I wouldn't have let her use them? That's my problem. She's not respectful of my room and privacy and will WAKE ME UP IN THE MORNINGS if she wants something from me despite the fact I'm supposed to be left alone when sleeping because I'm a hypersomniac? That's my problem.My parents have the ""grow a thicker skin"" mentality and are quick to point out her severe anxiety when giving her a reason to do things but blaming my meltdowns or issues on schizophrenia/autism isn't allowed. I couldn't take it any more today and I snapped and I yelled at them both. I just wanted a muffin. I broke down in tears and my sister laughed at me and I was sent to my room shortly after her asked my mother what her plans are to make sure this doesn't happen again and she laughed at me.I feel like maybe I went too far. Maybe I should have just let it go.I haven't eaten today and I don't think I can. When my routine gets messed up like this I can't eat for a day or so or I'll vomit. I'm incredibly depressed and I don't know what to do.  Am I as ridiculous as I feel I sound?"
