,judgement,title,score,id,num_comments,body
0,Everyone Sucks,AITA for not sharing son’s investment account with daughter?,5218,m16pyj,1734,"Hey All,My son was born in 2000 and I shortly afterwards opened up an investment account with the intentions of handing it off to him after he graduated college to give him a head start in life.  Wife loved the idea!I put in $10K initially and started adding $100/monthly and the account sits at over $60K today.  A majority of it was just put into mutual funds and some months I’d take the $100 and toss it into riskier stocks that didn’t really pan out.  (Yes I learned my lesson that if you’re not making this a career, just toss it into funds)When our daughter was born 2yrs later I started up an account for her as well.  About a year in, wife & I got drunk with friends and the topic of investing came up.  Wife said something silly along the lines of “anybody can invest” and it became a lengthy discussion at the beach with all our friends chiming in.  In the end, wanted to take over daughters investment account and manage it to show me how easy investing was.  We discussed it at length over the following weeks and she dug her heels in, so i relented and gave her control.  Long story short, that account sits at just over $16K for two reasons: because she picked (bad) individual stocks instead of funds and she wasn’t adding to the account at the start of the month.  Well, we had a blowout fight about a week ago after I mentioned to our son that he was going to inherit a bunch of money once he graduates this spring.  Naturally, our daughter wanted to know if and how much she was going to receive.  I mentioned that of course I’d done the same for her, but she’d have to ask mom as I wasn’t about to be the one to set that ticking time bomb off.  After wife showed the numbers the meltdown happened and then she told our daughter we’d just combine the accounts and split them equally.  At this point I flipped a lid and explained we’d definitely not do that because in her “everybody can invest” BS she’d insulted how difficult investing was and needed to deal with the ramifications of poor choices in investing.We’ve not had a meaningful discussion since, we’ve been cold to one another since, and our daughter is mad at us for the significantly smaller account she stands to inherit.AITA?*EDIT*My wife had full control of the accounts. I would ask her how it's going, and she was telling me the account was doing well. I trusted her, so I did not ask to login to the account to see for myself.*EDIT 2*My son's account had $14.7K in it at the time of the challenge. My daughter's account had roughly $11K in it.*EDIT 3*I’m halfway tempted just to give them each $15K and take the rest and buy myself a new truck seeing as how I’ve become the bad guy.  There, they get the sane amount and I reward myself for successful investing.  Probably the only happy person in this equation then, but I’m mind blown at all the attacks...*EDIT 4*Since most of you say I should just split the two accounts in half...I’ve decided on a fair solution. I will split the money with both kids, but I will give them all the statements from both accounts, and show them that the $37k each they're getting could have been about $60k each if not for their mother's poor investment choices.It’s their money - they have a right to know what happened to it."
1,Everyone Sucks,AITA For thinking I shouldn’t have to move back in with my mom,1227,m13lcc,345,"To start out I’m 17( 6 months away from being 18) my dad is out of the picture and my mom decided to up and leave and go live with her boyfriend  3 months ago.Which is all cool I understand she wanted to be happy after her breast cancer so it wasn’t that big of a deal to me. But I was/ am living alone in a house that my mom pays for, I have a job, make pretty good money for a 17 year old, and have good grades ( A’s and B’s). My mom even asked me to go live with my brother and grandma for a week or two to take care of my grandma because she has dementia and my brother couldn’t handle it anymore. Now the problem is that my mom found out I smoke weed probably 2 -3 times a week 30 minutes before I go to bed (Yes i know it is not good for my memory at all) and she is trying to now make me move in with her and her boyfriend. I told her no I don’t want to and her boyfriend threatened me if I didn’t stay at his house and we got into a huge argument. In my opinion if I’m going to be treated like an adult having to buy my own groceries, having to take care of my grandma, and work, then I think I shouldn’t be punished for smoking a few nights out of the week. My mom thinks I’m completely in the wrong here but I don’t think I am, but I definitely could be I’m not sure ."
2,Everyone Sucks,"AITA I (21,f) told my aunt (47) that maybe if she had a higher education she might know what a drug addiction is",78,m1i616,40,"This event happened 2 years ago but it has recently come up again with my grandparents. I believe my aunt has some serious issues, however my still grandparents think I was mostly in the wrong. My grandpa has back issues which cause him a lot of pain sometimes. That's why when I come over he sometimes asks me if I can bring a joint (weed) with me. This time he had asked me to bring one, so when I was there we smoked it in the yard.I find it very funny to see an old man, especially my grandpa, smoke a joint so I snapped a pic of it. Then my grandpa asked me to send it to my aunt, his daughter. This is where things went south...She immediatly texted back that she doesn't think it is funny and that is pathetic. I told her it's not a big deal and that's it legal where we live. That's when she began calling me stupid and she called me. I couldn't get a word in, the call was basically just her screaming and cussing at me and then hanging up.I told her I don't appreciate being yelled at, and that many problems can be solved by not making a problem out of it. I also explained that the only reason I send it to her is because grandpa asked me to.Then she told me ""how can you study at an university while you're so dumb"", and also, this is why I think she is quite insane, send me the nutrional facts for a piece of meat. Saying that I let my braincells die because I'm vegetarian and smoking weed. (for some reason she has a problem with me not eating meat?)I tried to be nice and hush the situation and then she called me a drug addict AGAIN and thats when I snapped and told her that maybe if she had a higher education aswell she might know what a drug addiction is. After this comment I immediatly apologized. The conversation ended with me telling her that we are entitled to our own opinions and lets quit arguing. And her last message to me was that I am to never contact her again because I am a drug addict and that she is much smarter than me and my mom. (idk why she suddenly began about my mom)My grandparents practically raised me and they are the best people I know. However their reaction to this is that we are both equally in the wrong, because I also said something mean. I feel like me saying ONE thing that could be conceived as mean ONLY after she called me every bad name in the book, yelling at me and belittling me, doesn't make me as rude as her.I feel very betrayed by both my grandparents and my aunt, and I thought my grandparents would be on my side. But after discussing further and having read the messages they still aren't. Was I really being an AH to my aunt?Fun fact: My aunt smokes a pack of sigaretes a dayTldr I send my aunt a pic of my grandpa smoking a joint, she went full mental on me (called me a drug addict among other things) and I said that if she had a higher education she might understand what a drug addiction is."
3,Everyone Sucks,AITA for getting mad at my wife for leaving our sleeping baby on the couch alone?,65,m1buuw,110,"My wife and I had our first baby 7 months ago, an amazing baby boy. Thankfully we got lucky with our jobs and both have been lucky enough to be working from home during the pandemic. When it comes to parenting we don't always see eye to eye but we both make compromises. Now my wife adores my son but something she did and said pissed me off.My wife works a couple of hours earlier than I do so I'm usually asleep while she takes care of him in the morning. I just so happened to get up earlier than normal this day and I made breakfast and we were having a pleasant morning. My wife had gotten him to sleep and since it would only be a short nap she put him down next to her on the couch. I went to my desk to start my work and I watched as she got up and went to go use the restroom.Now I was pretty annoyed that she would leave him unattended, sleeping or not, and sat next to him and waited for her to come back out. When she did I asked her to let me know next time she needed to go and I would get up to watch him. She told me that he would be fine and that she does it all the time when I'm asleep.   At this point I became pretty furious and I hate to admit it but I raised my voice and began to tell her how bad of an idea that was and she just fought with me on it dismissing my concerns which made me even more angry at that point.AITA for getting angry with her?EDIT: To add some context the couch is raised and we have hardwood floors. She watches him alone for a couple of hours in the morning and i do the same at night to allow her to sleep earlier. "
4,Everyone Sucks,AITA for calling over my wife to clean up our son's poop?,62,m1cds8,166,"Yesterday, my wife posted a set of videos on Facebook. The first one pans to me lying in bed on my phone, then shows our son eating Cheerios, with something on his hands. My wife asks him what the brown stuff is on his hands, and then after looking at his diaper, it looks like we've found the answer: it's poop. The second and third videos are of my wife washing our son and of the poop smeared on the inside of our second baby's empty bassinet, including on the sheets. The caption reads something like ""Husband called me over saying our son needed help, and this is what I came in to.""The first impression looks really bad, I admit. And apparently others thought so too because my father-in-law posts a comment asking why I was just lying in bed while our son smearing poop everywhere. Two of our mutual friends comment poking fun at each other saying that they're as neglectful to their son as I seem to be.Now here's where my part of the story comes in. What the videos leave out is the fact that I had been sleeping, cuddling with our newborn, and had just woken up to see that our older son had what I thought might be poop on his hands. My wife had left me alone to somehow watch the two of them while I was asleep. She recorded the video at just the right angle to cut out the newborn sleeping on my arm, so nobody watching the video could tell I wasn't just lying in bed on my phone out of sheer laziness.Our newborn is very fussy about not being held, and he was pinning down my arm, so I thought since my wife was available in the other room, I'd call her over to ask her to check on our son while I stayed cuddled with new baby to avoid waking him up.I don't believe there was anything wrong with me asking for some help here. The alternative would have been to leave the newborn by himself on the bed unattended, while I took 15 minutes to wash our older son in the bathtub, watch both our sons, and clean the furniture alone.My thinking is, if she's so outraged at having to wash our son and the furniture without also having to watch our newborn, how can she not understand that me doing all of that plus somehow watching our newborn warrants some degree of help? If she had been the one cuddling our newborn and had called me over, I would have just done it without any resentment, because I would've understood that it was more efficient for me to do so instead of her.Additionally, if she had asked me to switch places, I would've been fine with that.The post was up for hours with a lot of views and comments before I even saw it. She's since deleted the post so that nobody can see my comments anymore. And now some mutual friends have seen the post without also seeing my defense, and I've noticed that some have even started to avoid interacting with me.I really don't think that it was wrong of me to call her over, but I'm open to hearing what you all have to say. So Reddit, AITA?"
5,Everyone Sucks,AITA for telling my gf (28F) I (29M) don't like her bra,25,m1fory,98,"My GF of 10 years often points out things she doesn't like I do or buy. I don't like that but I'm okay with that. We are completely different people and we like different things. I would love to have similar taste for things, for example activities, clothing or cars (she hates mine and said that many times, but it's all good). She has a right for an opinion.Now, I think she's beautiful and stunning, but I don't really love the style of her clothing. I don't like a few things about how she dresses: we have different styles and I basically think that we should try to look nice for each other even if we stay at home, but again it's okay - that's her choice. I love her not because of what she wears.As we both know we like different things, we have decided that for Christmas we will gift each other huge packs of underwear we like for each other and we did. She liked some stuff I gifted, she returned some of it.Lately, she bought a new sports bra (she got it for a couple of dollars on AliExpress) and since it's pandemic and she's working from home she wears it all the time. I get that it might be really comfortable for her but I don't like the material, I don't like the color and I don't like how it looks on her. Basically anything would look better on her imho.So today, when we were driving together and talking about clothing, it somehow slipped off my tongue that I don't like that bra and I joked that I'm waiting for it to wear out so she starts to wear something else. She was completely devastated. She said that I have let her down, that I don't have empathy and she was instantly very hostile.I tried to tell her that it's nothing about her, I was talking about the bra and not her body or something (which she knows I completely adore and find her beautiful) but I felt that she was instantly passive aggressive and we had a pretty bad argument without understanding each other. I argued that it's the same thing she says about my car and we both have a right for opinion, but she told that it's completely different things, it's hurting her feelings, her insecurities and I just don't get women, I don't understand emotions and don't have empathy.I feel wrongly accused (and I feel that pretty often), but hey, I might be wrong here, right? So please, tell me - am I the asshole? Is it really such a delicate matter?"
6,Everyone Sucks,AITA for not apologizing to my dad and possibly sister?,552,m0x40y,48,"So today I (F23) was in a car accident. Completely the other party’s fault, he switched lanes into my lane completely slamming into the front half of my car. He had a faulty right side mirror and didn’t bother to look behind him and boom, the front piece of my car and headlight is torn off. Nobody was hurt, but I was pretty annoyed and shaken up.I called my dad (60M) to ask if he could pick me up, since I had to have my car towed. He says yes, he’ll be there shortly. He lives 20 minutes away from the accident site and is retired, so he didn’t have to call out of work or any other responsibilities. It took him an hour and a half to come get me, slower than the tow service, so I was a little bit annoyed. I would have just gotten an uber to work if I had known it was going to take this long.I thought, it’s ok, he’s doing me a favor, I shouldn’t complain so I didn’t. He then proceeds to lecture me in the car ride about the “importance of defensive driving so these things don’t happen,” and IMO kind of implies that I could have prevented this, which further gets under my skin because this was in no way my fault AT ALL and I really don’t think is appropriate to say to someone who’s just been in a very anxiety inducing accident. I got into work absolutely slammed with paperwork that I now had much less time to complete.Later that night I’ve been on the phone with insurance companies for hours, and am at this point having a day from hell. I ask my sister (18F) if for the rest of the week I can use the car she normally uses. This is my family’s car, not hers, and my parents are happy to drop her off/pick her up at school. The asking was mostly a formality because it’s not actually her car, and I already cleared it with my parents. Sister says she “needs some time to think about it” and this is where I might be the asshole. I kind of snapped at her and told her that me asking was just a formality and that I have a job I need to get to, and had cleared it with our parents. I also said I would be happy to pick her up or drop her off places, but I really did need the car. My dad yells at me that I need to be more polite about things. I yell back at him, saying that my job is important to me and me asking WAS me being polite to my sister. I don’t want to disrespect my sister or make her feel like her activities aren’t valuable or something, and I don’t want to come across as a brat. Was I totally out of line?Edit: Thanks everyone, I’ve apologized to my sister and talked to my dad and we’re all cool. Tensions were a little high after this accident just from the stress of the whole thing. I do love my dad and sister very much, and I am very grateful to have both of them in my life, so I’m glad y’all snapped me out of my anxiety induced grumpiness to apologize lol. I appreciate the input!"
7,Everyone Sucks,AITA for mentioning something my whole family never talks about?,1342,m0p3o5,148,"I (33F) was on a zoom call with my mother, my aunt and my aunt's daughter, who I will call Gina for this. I'm getting married later this year and they just wanted to have some wedding talk. Gina is a heart surgeon, very respected and very good at what she does. While I don't dislike her, I'd say she isn't a nice person. In fact I'd say she's a genuine psychopath from some of the things she's done in the past. As a teenager Gina was part of a gang of kids who were bullies and troublemakers. It got a lot more serious than that, to the point that Gina and a few of her friends were arrested and charged with a crime. I'm not going to say what it was, but it was serious enough that they had to be held in custody while awaiting trial and were refused bail. Long story short, my aunt and uncle had money, and pulled a lot of strings to make the charges against their daughter go away and get her released from custody. Ever since it's been an unspoken rule that her court case and being held in custody is something that nobody in the family ever brings up. Keep in mind that Gina's court case was well over 20 years ago now. To be fair to Gina, she took the opportunity she was given. She worked hard and has a great career, and I'm truly happy for her. Gina loves nice clothes and has a very large collection of gorgeous outfits as well as a collection of louboutins and other cool shoes. She was talking about what she might wear to the wedding, and made a joke that she ""hopes she doesn't outshine me too much"". I was offended at what she said. It's not out of the ordinary for her to say a cruel comment like that but I didn't like the fact that she actually wanted to spoil my day. In response I asked Gina if she kept her prison uniform and said she'd get all the attention if she wore that. Gina didn't seem to care but my aunt was absolutely raging, saying I'd crossed a line by mentioning ""that"". She left the call and Gina left soon after. My mother gave me a long lecture, saying that I should have known that was a sensitive topic for them. I'm sorry but I wasn't the one making jokes about ruining someone's wedding with their nice clothes. She made a cruel joke so I made one back. What's wrong with that?"
8,Everyone Sucks,AITA for not washing a cutting board that my brother used,9,m1gtnl,18,"My brother and I just had an argument over a cutting board, and I genuinely think I was right. I used the cutting board to make an avocado salad and didn't wash it after wards because I assumed the next person to use it, would also need it to cut the same things. And I was right since he used it to cut some tomatoes, onions and peppers. However after doing so, he told me ""I'm done with the cutting board, clean it"" and I said ""well if you found it in a clean enough state to use, wouldn't that mean you should clean it"" and we began arguing. This argument isn't serious but am I right?"
9,Everyone Sucks,AITA for being the middle man for my wife and our roommates argument and telling my wife to let it go and move on?,20,m19jtk,91,"My wife with her emotional support dog, 2 year old daughter and I moved into a house with a Family my wife grew up with, they travel for work  and can be gone for 10 months of the year. My wife can be stubborn at times and when they get into an argument my wife tends to stay angry longer than she should so I step in to try to help calm both sides down. I try to see both sides and act accordingly and try to be unbiased to my wife.A argument happened while I was at work and the roommates were home. My wife's dad just had neck surgery and is on medication that gives him anxiety and so my wife goes over to help him since she has dealt with anxiety most of her life. She has to keep her dog at home because he has a bigger dog that tries to attack it and when put away he continuously tries to get out and won't stop barking so my wife leaves her dog at home. My wife didn't ask if our roommates could watch her dog and the dog is still being potty trained to go out side. They messaged my wife saying they were leaving for a bit and wanted to know where her cage was (We are trying to crate train her dog but decided to wait for the roommates to leave since she barks a lot while in there and they keep yelling at her to stop) my wife replied saying please don't put her in due to not being use to it yet and she tends to eat her own poop and to just put her in our room. Shortly after my wife gets home and finds that they put the dog in the cage any ways and left. She got upset and told them that they disrespected her wishes. Their argument was she didn't ask and they didn't want her dog to poop and pee in the house. My wife then put the dog in our room and locks the door to our daughter's door. While at work I get a call from the roommates saying my wife had no right to lock our daughter's room and our room and threaten to take our doors off.I don't agree 100% with them but after talking to them I can get their side minus the removing our doors part. I also don't 100% agree with my wife only for the fact she keeps bringing things up from past arguments and tries to throw it in their face. Our roommates have helped us out financially a few times but they also see my wife like a daughter to them since she grew up with them and tries to tell her how to raise our daughter and train her dog and get annoyed that we don't always follow their advice they give.I have told my wife to just ignore the small things and them putting the dog in the cage was one time and if they did it multiple times then be angry about it. They talk to me and are ok and got some toys for my daughter but since my wife hasn't talked to them since that day the make some remakes like saying when is she going to grow up.  AITA for telling my wife to let it go and move on?Edit: I want to thank everyone for the different views on the situation and the feedback a lot gave. I want to also add a few things.1. The dog was prescribed by my wife's therapist and we got a puppy, she is 4 months old, so we could give it training for her anxiety.2. The roommates got a puppy from the same place we did and is the same age as ours, only a few months old and is still getting potty trained as well.3. Some people asked why don't we move out, we actually moved in mid january and I just got a new job so we are trying to save up what we can to find a new place. As far as lease goes, we are in a month to month with our landlordAgain thank you all for the feed back and I see now some of you are right, I do need to stand for my wife more. I also want to say I don't 100% agree with both sides considering this argument happened over them putting the dog in her crate. To me it was something small that both sides grew into something big. I am going to talk to my wife more about it and try to talk to them to hopefully come to reason. We are going to save as much as we can to hopefully find a new place to go since things don't look to be working out here."
