,judgement,title,score,id,num_comments,body
223,Not the A-hole,AITA for hanging a photo of my family (including boyfriend) in my apartment,14093,lznyj9,855,"My boyfriend (32M) recently moved into my (27F) apartment. We have been dating for a while (a little more than a year) and decided that it was time to make things serious. I have a daughter (6F) who also lives with me and visits with her father every other weekend. I work in a quite demanding job and my daughter used to either stay with my parents or be at a daycare while I worked. However, with the current state of the world, my boyfriend has been able to keep an eye on her mostly. I'm still in the house, but he's been doing stuff when I'm not able to like checking what she's doing for school and making her lunch. She's also taken an interest in music and my boyfriend used to be in a band his teenage years and she's fascinated by that and they spend a lot of time playing the guitar together. So they've gotten pretty close and they are quite fond of each other. As my boyfriend has moved in, we've taken to redecorating a bit to make it our space and I put a frame of the three of us (me, daughter, and boyfriend) in the living room. It's a sweet photo of a happy day that we are all fond of. There are other photos around the house with my boyfriend and there's a few of my boyfriend teaching my daughter the guitar, stuff like that. I don't have any photos of my ex around the apartment, but in my daughters room, we've hung photos of her and her Dad (they were always there). My ex and I have a complicated history, but we are now cordial. The other day, when my ex came to pick up our daughter for the weekend, he noticed the changes and the pictures. I didn't really notice until later, but he left kind of mad. He then called me around midnight and ranted to me about how disrespectful it is to have a family-style photo with him not including in any of them and how its going to negatively affect our daughter's relationship with him and that I'm purposefully trying to alienate our daughter from him. Apparently, our daughter also has started talking about my boyfriend a lot in front of her father and that rubbed him the wrong way. He wants me to remove the photos or add a photo with the three of us (him, me and our kid), both requests which I've refused. Am I the asshole?"
224,Not the A-hole,AITA for confronting my friend and calling them racist?,0,m1gpw7,11,"This post is similar to another post I made a few days ago. I'll just reference a bit of what was said for the sake of brevity and need to hear more opinions. I think I am being gaslit in this situation they think my sensitivity is the problem. It is really strange because these people are emotionally available when it comes to my depression and possible BDD, so it is hard to completely hate them. They also claim that they're the only ones allowed to pick on me, but they wouldn't allow someone else to do the same thing?The friends in a Discord chat were telling me to shut up because I was not comfortable with them using the N-word and as an immature way to defend their point, one of them sent in a racist meme that said ""shut up, N-word (hard r)"". Just to preface, they know that I am Black. I am the only person in that group that is Black (background information). Those ""friends"" all reacted to the meme with laughing emojis instead of confronting the person that directed the meme at me. That person pretty much called me the N-word, and I kept telling them that it is racist and unacceptable to say it. ""As long as it is used correctly it can be funny"", one of them said. There were other very insensitive jokes said to me. Because they know I am Muslim and below average in height (only 5'1, whatever), they sent in memes of Sikh men with dwarfism and said ""is this you?"" It really offended me, simply because being Muslim and south Asian are obviously not mutually exclusive. I pretty much made the clarification that the person in the photo was most likely a Sikh, not a Muslim. One of them (who is White, all of them are actually) gets pretty upset with me and thinks I am annoying whenever I correct him because he thinks I am intentionally patronizing him. This is the same guy that has also called me the ""support sex"" because ""women don't need to orgasm to reproduce."" . He also proceeded to say that my game character's skin color is ""dark"", so I confronted him for being racist. He kept trying to tell me ""let it be known I am not racist"", etc etc. They have also called me ""curry muncher"" and ""turban sniffer"", not understanding how ignorant and stereotypical those comments are simply because I'm 1. Black 2. I wear a hijab, not a ""turban"". I am thinking about slowly cutting off contact from them and then blocking them because I am honestly not the best with confrontation and have an anxiety disorder. Emotionally speaking, I am absolutely done with their crap. They have been there for me when I was depressed, but honestly I don't think they respect me that much if they are aware of possibly offending me yet continue to say ignorant things towards me. They have all called me a sensitive snowflake and that it is ""only a joke""  whenever I brought up their ignorant racism. I cannot keep this bottled inside me any longer. AITA?"
225,Not the A-hole,WIBTA For Not Issuing Refund?,25,m0jo1o,19,"I recently sold a vintage acoustic guitar online. It was in pretty rough shape, but still playable (which was made explicit in my post). I mentioned every problem that I was aware of and sold the item in good faith. When the buyer first received it, he left a review saying everything was just as described. Now, three weeks after he’s received it, the buyer has notified me that part of the back of the guitar has separated, and he wants a refund. It’s beyond the website’s return window. He claims that the repair would exceed the cost of the guitar, which isn’t true. Based on my research and having similar repairs done in the past, I think that the repair cost would be about half of the price that he purchased the guitar for. But maybe that’s neither here nor there. I’m sort of torn. On the one hand, I feel bad that he’s having problems with the gear I sold. On the other hand, he took a risk buying a 60 year old guitar online, which I clearly indicated was in rough shape. Also, I don’t know what he’s done with it in the meantime. He could’ve dropped it, or tuned the strings too high, or any number of other things. I needed the money when I sold the guitar. I waited for two weeks, which is the website’s return window, and then spent the money on essentials—times are a bit hard right now. I can’t really afford to give the guy back his money, and, again, I waited until the return window was up to use it.So, would I be the asshole for not issuing a refund?"
226,Not the A-hole,Aita for being pissed at my boyfriend for yelling at me for not turning the lights on because I have a headache and he needs to stay awake?,54,m0f9ca,76,"I've had a headache for hours, I took ibuprofen and slept for a bit but it hurts so badly I woke up and can't fall back asleep. So the bedroom light is off but our closet light is on and it's really bright so I went to turn it off and my boyfriend starts yelling at me. ""Seriously what are you doing? I have an appointment in an hour I need to stay awake. I want to turn the bedroom light too"" and I was like seriously? Are you kidding? Shhh please my head is killing me. Ugh fine, I turn the closest light on. But then he starts complaining that ""I'm selfish"" because I won't turn the light on. But I told him I think he's being selfish, and I shouldn't have to suffer through a headache because he can't stay awake without all the lights being on. He can be responsible and stay awake if he really needs too. I keept putting a blanket over my head because it hurts so badly but it's not helping. He went to sit in the living room and I finally gave up and starting looking at my phone. Sorry for any errors my head is actually throbbing and im on mobile. So am I the asshole?"
227,Not the A-hole,AITA for walking out on dinner with my parents after having an argument?,111,m0bgx0,48,"A few years ago, when I was 20 years old, I was still living at my parents home.After a few months of my girlfriend visiting me on a regular basis and staying over night, they felt annoyed by her presence. They told me they did not have enough privacy anymore, even though for the most part me and my GF were only staying in my room or spent time outside. Sometimes we would make some food in the kitchen but that's it. And it's not like we had loud sex or anything like that. At a certain point my parents told me that my girlfriend could only come by once a week from now on. I got into an argument with them and my mum became angry and basically called my GF a parasite. She said that my GF had creeped her way into living in my room, even though she always returned back to her own home after three or four days.At the time we spend almost the same amount of days at her parents home, but her parents didn‘t mind me spending time there.There was one particularly bad moment where my GF was alone in my room and my mother was raging out about her right in front of the door. She even got my two little brothers to agree with her and say that my GF was annoying.I decided it was time to move out. When I told my mum about the idea of looking for my own flat she told me that I shouldn't do it.In my hometown most landlords reject university students (like me) without a legal paper that ensures that the parents will pay, if the child is unable to. But even with that paper it's very hard to find a flat here as there is a lot of demand and very little supply when it comes to the housing market. Unfortunately my mum did not want to sign the necessary legal paper.A couple of weeks later I found out that a friend of mine personally owned a flat that she was planning to rent out. Therefore I was lucky enough to move out without needing that legal paper. I moved out and me and my GF moved into the new flat together.Years later the relationship between my parents and my GF is still very bad. They completely avoid meeting each other and every time I visit my parents they basically ignore the fact that she even exists. My mother keeps making suggestions that I should spend a year abroad or move to another city without my GF and it often feels like she secretly wants us to break up.Today I went over to my parents home in order to have dinner with them and for some reason this old argument was revitalised. My mother still insists that my GF was a parasite at that time. She also claims that she herself didn't behave in a bad way and still blames my GF for everything. I shouted at her for still talking about my GF that way. Until at a certain point I just left.I feel very bad for my little brothers and my dad, who had to witness this fight. I think I could have done a much better job at handling the situation. The sad thing is, I kinda feel like I broke up with my family today and that hurts. I don't want to lose my relationship with them but I also don't want to live a double live between my family and my girlfriend."
228,Not the A-hole,WIBTA if I told my Dad to give me back my money,15,m0orqv,25,Imma keep this short I have always wanted some electronic that is solely mine and when the switch came out I asked my dad if I could get it he said if I paid for it so I ended up doing what I could around the house to get money and I got enough to buy 2 games and the switch. I ended up finding out that my money was taken I asked him and he acted dumb he and my mum were the only ones who knew where I had hidden it and my mum went out that day. So I was having a convo with my family and my Dad's lies were brought up so I decided I should maybe I should confront him so here I am.WIBTA if I told my dad to give me back my money.
229,Not the A-hole,AITA for not accepting my boyfriends friends apology?,1134,lzy90w,97,"Vague title, I know, bare with me! My (23f) boyfriends (25m) best friend (who I will call S) has been staying with us for a while, I work a lot as does he so we don’t hang out especially often. The first incident that caused upset was a few weeks ago.It was my day off and I wanted to feel nice, got dressed in the morning in clothes I was happy and confident in. Stressful times can be eased by the simplest of solutions. I decide to go outside to smoke and S joins me. We chat and I mention that that morning I’d received an unusually crass comment when I was at the cash point and how it had really bummed me out as I was feeling confident beforehand. He stares at my chest for an extended period of time, unabashedly) and tells me that its to be expected if I’m wearing what I'm wearing in this area.That upset me but I remained quiet, I checked my phone and he’s commented drooling emojis on my instagram photo in that outfit. I think maybe he’s just uncomfortable or not aware of what that would regularly mean. I mention it to my boyfriend and he comments on how weird it was and we moved on.A few days later, S has his girlfriend over who I love to pieces. Drinks are consumed, more so by others than me but I’m enjoying the vibe and everything. Midnight rolls around and I go to pee, my boyfriend then lets the other two know that its now my dads birthday (who died last year) and not mention it but be wary I might be a bit down. I come back unaware that this conversation has happened and his girlfriend and I continue to chat. It came up organically and we had a really lovely conversation about it. This was the first time I’d told her some of the more unpleasant parts about my dads death and I got quite sad. S had been listening the whole time and looks at me deadpan and says “Oh so thats why you have massive daddy issues”. I told him that wasn’t acceptable and excused myself to go to the bathroom. My boyfriend told him to apologise which S said he didn’t feel was necessary. Regardless he gave me a very lacklustre apology. Think along the lines of “I'm sorry you got upset”.Well I was extremely hurt by this and my boyfriend was also pretty angry. Probably the angriest I’ve seen him for a while. S has moved out to his new place now (unrelated to this argument) and I’ve not spoken to him since, he’s expressed his want to apologise and I’ve obviously told my boyfriend that he is 100% allowed to forgive him FOR him but I don’t want to forgive him. Bf can chill with him whenever but I just don’t want to hang with him anymore. I do feel guilty for holding a grudge about it but it did really hurt me.S said that me not speaking to him has caused him anxiety so I am starting to feel guilty about not wanting to and I don't want to put my bf in an awkward position. I just don’t enjoy his company anymore and instances like this have increased recently towards me.So reddit, AITA?"
230,Not the A-hole,AITA for asking to share antivirus expenses?,4,m0w8iy,19,"I (21F) asked my brother (19M) for a little bit of money toward the yearly antivirus costs. It’s $120 a year, and with me being a college student on minimum wage, it always hits me decently hard at the time because they charge it all at once. Every member of my family has been given the login and has the program on their computer, but only because I have shared it with them— they don’t get pushy, I’ve just offered because I have to pay for it anyway. It’s continued where I foot the bill for about 4 years now. This time around, though, I asked for some funds toward it from my mother (44F) and aforementioned brother, as they are both adults with income also. My brother sent me $30, but my mom wasn’t so willing. She felt that it was cheap to offer it and then ask for money for it. I understand where she’s coming from, but I want to know if I was in the wrong here. Thanks!"
231,Not the A-hole,WIBTA if I told my sister what my cousin said about her daughter?,189,m08o6g,26,"My sister has a daughter (8F) she has a mild form of Beckwith-Wiedemann Syndrome. It doesn’t effect her much other than she’s bigger than a lot of kids in her class, she has to get regular ultrasounds to check her organs, and she has a little speech impediment! She is my favorite person on the planet, she is kind, smart, and has a bold personality. I helped my sister by nannying for her when my niece was born till she was 9 months, so she’s super important to me and she acts like I’m her second mom. I was talking to my cousin (37M) earlier today, and he’s been dating a girl for maybe two years. She has a daughter who is 10. He kept going on and on about how smart their kid is and how she’s so much smarter and on another league than my niece. And how my niece should learn how to talk properly at her age. I literally was seeing red. My niece is not stupid, she can read, write, spell, do basic math, tell time. Her teachers always say how kind and smart she is. She just has trouble speaking from the syndrome she has. It doesn’t effect her mental capacity at all. I don’t know if I should say something to my sister about it, or if I should just let it go. WIBTA if I told her? TLDR: My niece has a speech impediment, and my cousin was was acting like she’s not smart because of it. I don’t know if I should tell my sister."
232,Not the A-hole,AITA? Can't Sleep When Being Poked,155,m09otx,74,"Hey everyone. I've been creeping on this sub for awhile now and want some input. This is probably a little TMI, so I'm sorry.Myself (25f) and my fiancé (24m) have been together for two and half years and have been engaged since November 2020. We've been living together since May 2019. Obviously we share a bed. I'm a light sleeper and my biggest thing is being woken up when I'm touched.My fiancé is very touch-feely, and we both enjoy cuddling. However, I'm always woken up by the night-time boner many men seem to get. I understand it's an unconscious thing that happens during sleep, but it wakes me up and it's hard for me to fall back asleep after being woken, especially with something poking me in the back. I started putting some of the blankets between us (pulled down over us, so not a lump of extra blankets), that way we are cuddling but there is a small barrier between us. I'm able to fall back asleep, and the cuddling gets to continue.I woke up a couple days ago and he told me he was really hurt by this and it hurt his feelings a lot by me putting the blankets between us while we slept. I explained the issue and he understood my point of view, however he was still hurt. AITA?I think IATA because I do something that is hurting my fiancés feelings, for the sake of my own comfort."
233,Not the A-hole,AITA for giving my best friend of six years my last will and testament to hold onto instead of my parents?,239,m0756m,45,"Okay, little context. I work in a very dangerous industry, one where I am at risk of either serious bodily injury or death every single day. I don't want to name the field I'm in because it could reveal my identity and I'm not into that. Let's just say it's tied to the aviation industry. So because my job constantly has me at risk, I have a written will, like most folks. I'm 25 btw, but the nature of my job makes not having one a very bad idea. In addition to the will, I have written a letter to my best friend to be opened only if something happens to me. He holds onto both for me. I had to take him an updated copy of my will so I had it in my car to take to him on the way to work. My dad (who I currently live with due to some money constraints I don't want to get into) needed to move my car. So he used my keys to move it and he found the letter. To be clear, the issue isn't that my dad moved the car. That's totally fine. He's got places to go and I wasn't home so whatever. To his credit, he didn't open the envelope, but he was curious. It had my best friends name on it. In addition to having a personal letter to my best friend, I also had a few other letters for other people too in there for him to distribute in the case of my demise. When I got home, he asked me about it. I explained to him what it was and he was furious. He yelled at me and asked me why I didn't have him hold onto the letters instead of my best friend. I told him that the letter was personal and between me and my best friend and to please stay out of it and that he's been holding onto this stuff for at least two years already and that these where updated documents. He was so angry he left the room and hasn't talked me. My best friend feels terrible about it, it's not his fault. But I feel bad, maybe I was the asshole here but I just don't know. The reason he was holding onto them in the first place was I didn't think I could trust my dad not to open my letters to other people in my life that are important to me because of previous experiences. So, I just don't know. AITA?"
234,Not the A-hole,AITA for snapping at a masseuse and basically getting her in trouble?,1379,lzwexd,247,"Background: -I have back problems and need to either go to the chiropractor or a deep massage every two months or so.-My left arm has a bunch of sh scars with one being pretty big. I keep the big one covered with special tape so it doesn’t show as much. Also, the tape is basically liquid prof and I don’t have to remove it to shower, apply lotion or anything of the sort.-I live in a Latin countryOkay into the story, I hadn’t gotten a treatment in about seven months due to COVID shutting down spas and my go-to chiropractor deciding he wasn’t working until this whole thing was over. This obviously put me in a lot of stress and pain to the point that I ended up buying self massagers and a bunch of creams and stuff to help me cope. Last week I finally found a spa that was opening up again and immediately booked an appointment for a deep massage. During the massage everything was going great, I was finally feeling relaxed as the pain slowly went away, until the woman started doing my arms. Like I said, my scars are noticeable. I don’t deny it and I know people will be curious about them. Usually I don’t mind much when strangers try to get a look at my arm or some people even ask to touch them from time to time and although it does make me very uncomfortable but I don’t mention it.This time though, I was in what I expected to be a professional environment where the staff is supposed to make me feel comfortable and relaxed. The lady starts doing my left arm and suddenly I can feel her tense up. (Okay no big deal, she sees them, it’s fine) Now, I do understand and respect the fact that some people might feel uncomfortable or weirded out by my scars and their entitled to that feeling. What I don’t agree with is her tracing her fingers over them, and then proceeding to try and take my tape off. I had previously asked if I had to take it off during the massage and was specifically told that it wasn’t necessary since my comfort was important. When I pulled my arm away and politely asked her to not take my tape off she apologized and went back to the massage. A few second later, she does the same thing of trying to take it off and I, less politely, tell her to please ignore the tape and not try to take it off again. She, again, apologizes and continues the massage. She tries for a third time to take my tape off and I just get up, tell her I’m asking for a different masseuse and leave. Later I found out she got chastised and my massage ended up being free. I told my friends what happened and some immediately told me I was overreacting, that obviously people are going to be curious and I should expect people to want to see under the tape. The other side of my friends are saying that it was totally unprofessional of her to continue trying to take the tape off even after I told her to not do so and I was in my total right to snap and walk away. Now I can’t help but wonder if I overreacted.AITA for snapping at my masseuse and getting her in trouble?Edit: it’s been brought to my attention in the comments that the word ‘masseuse’ has a bad connotation to it and I want to apologize for using it. For some reason Reddit won’t let me change the wording of the original post but I now know to call you guys massage therapists. Sorry about the mix up and thank you for your comments!"
