,judgement,title,score,id,num_comments,body
0,Not the A-hole,"AITA for backing out of being a bridesmaid for my friend rather than take off my hijab, even after the other bridesmaids bought modest dresses to accommodate me?",9765,m1kmnt,1246,"We have been friends for 5 years, and in the whole time she's known me I've never taken my hijab off around men from outside my family. I have taken it off in front of her before, but only because I was only around women, and she knew this was the case. When we were trying on bridesmaid dresses, I offered to wear a different dress to the other bridesmaids or wear a covering over the dress so they didn't all have to conform to my needs regarding the modesty of the dress. We settled on all wearing a dress that I could wear, as the bride wanted us to match. I was happy that they accommodated me, and none of them seemed to mind wearing a more modest dress than they might have worn otherwise. Yesterday I asked the bride if she wanted me to wear a scarf that matched the dress or of a different colour. She was startled and told me she was expecting me not to wear a hijab, because when she said she wanted us all to match she thought I understood she meant not just the dresses, but that I would not be wearing a hijab. She also said that she thought I would be ok with it since I took my hijab off while trying on dresses, which I only did because I was only around women and I was trying on some dresses that go over the head so I felt the hijab would have fallen off anyway.I said that if I could not wear a hijab as a bridesmaid, I would not be able to be a bridesmaid. My friend is now frustrated as some of the other bridesmaids have made alterations to the dresses and cannot return them, and she would have wanted them to wear a different dress if it were not for my modesty needs. She's also annoyed that I have backed out as now there is an uneven number of bridesmaids and groomsmen.She says she tried her best to make a compromise with me, the modest dress but no hijab, and I should have explicitly said I would need to wear my hijab and not taken it off while trying on dresses. I think she should have explicitly asked if I would go without before committing to a compromise I didn't even know about.AITA?Edit: I messaged the other bridesmaids explaining that I can't be a bridesmaid anymore as the bride doesn't want me wearing a hijab, and the responses are coming in very much anti-bride so far. I'm hoping the others disagreeing with her on this will snap her out of it. It seems like she's overall stressed and focusing in on this one thing too much and hopefully if she stops to think about it she'll register that it's not a big deal if I'm wearing a hijab.Edit 2: got my first Islamophobic message from user sirharryflashman. Surprised it took this long.Edit 3: second place for sending Islamophobic messages goes to the charmingly named user Bitchtits024240. And third is disappointingly a Jedi master who should know better, user kiadi-mundi who sent an interesting twist on the Islamophobia: sexually explicit messages to try and make me uncomfortable."
1,Not the A-hole,AITA for getting my daughter a better laptop than my son?,20531,m1h95d,1623,"My son and daughter are both 17.  I got both of them  great laptops 4 years ago that should have lasted until now.  My son broke his just a year after they were bought.  I would’ve made him get one of the low quality laptops that their school issues, but my mom got him a new one.  He broke that one too in just 2 years. After that, I made him get one from his school.  A few days ago, that one broke.  I paid the school for it and decided to get him a used laptop that will be enough for school but not too expensive.  My daughter’s has worked fine until now.  Last week, my 7 year old spilled water on it and it doesn’t work anymore.  I’m getting her a pretty expensive new laptop because she hasn’t broken any electronics before and it wasn’t her fault.  My son saw that she’s getting a better laptop than him and he said that I’m being unfair.  I told him that he’s destroyed 3 laptops in 4 years and money doesn’t grow on trees.  He said that I’m picking favorites, and I love her more than him.  I said that he can get a better one with his own money when he starts working.  Am I the asshole?"
2,Not the A-hole,AITA For refusing to let my stepdaughter use my daughter's wedding dress?,10017,m1idmw,1180,I'll try my best to explain the situation and make sure to present both sides.I (f49) met my stepdaughter Zoey 2.5 years ago. I married her father less than 5months ago. It was a small and private celebration sine that's what we felt was the best thing to do since I'm still grieving my daughter Lauren who passed away from sepsis at the age of 26. It was so sudden. She was doing okay and was getting ready for her wedding that was supposed to happen the same month she passed away. We still don't know what went wrong. We were devastated to say the least. Her fiance had a hard time adapting to the new normal. I still have contact with him. We're very close.I took most of her belongings including her wedding dress. We bought it together and she put alot of her touches on it. Worked hard on it. Although it hurt to look at it. I make sure it's safe.Zoey's younger than Lauren. She's 23. We're not very close and distance is one of the reasons why. But we're very respectful towards each other. The issue started when Zoey visited to talk about her wedding in april. We were talking about wedding dresses and she suddenly brought up Lauren's wedding dress. I asked her what about it and she said she saw it several times and it got stuck on her mind. Asked if she could see it and I let her.She then said she'd like to wear it at her wedding. I felt uneasy. I told her I wasn't sure that was a good idea. She told me it's fine she'll have to change few things in it so it can fit her size and style but this is why I had a hard time accepting. I told her I was sorry but I can't let her have it. She offered me money but its sentimental value is what matters to me. She argued saying I was making things complicated and it was alright since she too is my daughter. She Asked if I don't love her as much I told her my love for her is different but she threw a fit calling me unfair and unreasonable to still say no.Her dad got involved in the argument saying he doesn't see why I'm against it. I declined to discuss it anymore but they kept bringing it up asking if my daughter would've wanted someone else to have the opportunity to wear this dress since she unfortunately couldn't. This made me so mad I lashed out at both of them and kept saying no. Others said that I had no right to act like that leaving the dress in the closet when my stepdaughter can make good memories with it. But she said she's planning on changing its look.
3,Not the A-hole,AITA for “guilting” my family into getting a one story home?,2911,m1j4ka,429,"My mom got a new job so we’re moving closer so she has less transportation time. She’s said that she wants it to be a family decision, and we’ve looked at a bunch of houses. While we have been looking for one I’ve mentioned that it would be nice if we could move somewhere that’s one floor so that half the house isn’t off limits for me (I’m in a wheelchair) and originally my mom said it shouldn’t really matter as long as there’s a bedroom and a bathroom on the ground floor. But at every house she’s liked that has two stories I’ve mentioned how I’d prefer it to be one floor. Today she snapped a bit and said that it’s unfair that I’m trying to guilt her about it when she already does a lot for me and that my preferences shouldn’t decide where we live, but my dad is also kind of on my side and has said that we should get something that’s one story as well. Was I the asshole for guilting her?"
4,Not the A-hole,AITA for getting upset with one of my coworkers who used my sonogram to 'fool' her exboyfriend into thinking she was pregnant?,7631,m1efiv,467,"Hello everyone. I am 27F. My husband and I  found out  two months ago we are expecting our first child. Last week, we officially announced it via text and phone calls to our friends and family. The next day at work, I found out that one of my coworkers had taken the photo of the sonogram I had sent them in the group text (someone had asked to see it) and posted it on her social media to 'fool' her exboyfriend (who she broke up with a few weeks ago) into thinking she was pregnant. I never wanted my sonogram on the internet, I don't have a facebook or an instagram or anything like that, and i feel extremely uncomfortable that it's out there without me being able to control the audience of who is looking at it. Also, this seems like an extremely cruel trick to play on someone, and she used *my* sonogram as a prop for this mean joke. When I expressed that I was upset to my coworker, she said i was being 'dramatic' and I am 'just looking for something to be upset over'. She said she covered up all identifying information, and that it was only up for a few hours and she told her exboyfriend the truth after 'making him sweat for a bit'. are pregnancy hormones making me more upset about this than I should be? AITA?"
5,Not the A-hole,AITA for not allowing my oldest daughter to use my home as her wedding venue because her mother and her family will be invited? I had a restraining order against them until recently.,19343,m18qrf,1764,"I'm in a pretty bad situation right now.When my stepdaughter got married two years ago, she used our home as the wedding venue. We have a meadow in our backyard that is able to accomodate a large number of people, as well as a empty clean barn that can be setup for dinner tables.My daughter was supposed to marry at another location last year but because of the pandemic, the venue shut down permanently.She's now asked to use my home for the wedding but I told her my issues with that. I had a restraining order against her mother, my ex, and a few members of her family after  threats and harrassment were directed towards my wife and myself.The restraining order expired mid last year but we haven't heard from them since but I stayed firm in my decision.This has upset my daughter greatly and she's screamed at me which she's never done.I offered to give her 15 thousand dollars for an alternative venue but now she's adamant about it being our home. I feel extremely uncomfortable giving my ex and her family access to my home because that's where the washrooms will be.My daughter has put this issue on Facebook and I now have all of my extended family against me. This has also stirred up my ex and her family against me.And worse is that my wife and stepdaughter are now being accused of trying to ruin my daughter's wedding when they haven't played any part in it.I'm planning on giving in and letting my daughter use our home for the wedding later this year. But I'm going to tell my wife and stepdaughter not to be around for it. Which I'm sure is going to create a bunch of other issues.Am I the asshole?UPDATE TO MY POST: I messaged my daughter about the outdoor trailer bathrooms and she has refused and said it was a disgusting idea. She then accused me of treating her worse then my stepdaughter and that I play favorites and that I'm a terrible father.She does not want the wedding at our home anymore and hung up.She is no longer picking up my calls.I got an angry call from my mother who says she is hosting her wedding instead. And that I will not be welcomed at the wedding. My father will be walking my daughter down the aisle instead of me.Thanks everyone for the advice. I appreciate it. But I feel like I've made the biggest mistake of my life. I'm completely heartbroken."
6,Not the A-hole,AITA if I ask my neighbors with a baby to keep it inside while it's crying?,2701,m1gl1x,1155,"Basically my neighbors across and left one house had a baby. They have this annoying habit of taking it when it's crying outside where it cries for an hour or more. Edit: They're with it the whole time when it's crying. They're not just leaving it outside lolI sent them an anonymous letter asking them to please keep it inside and not annoy everyone in a 3 house radius. I'll just type in here what I wrote.""Hi, congrats on your kid! I wanted to ask of you could please keep the crying baby inside. We hear it cry from quite far away. Thanks for considering it neighbor."" I get it that kids cry, but at last make it more manageable for the rest of us. That was about a week ago. I assume they got the letter about 3 days ago? Yesterday evening they were knocking on all their nearby neighbor's doors and asking them if they send the letter and they were pretty irate about the whole thing. One of their other neighbors was yelling back at them and saying they would have sent a longer letter about how annoying their baby was.Wife said I shouldn't have done that, but I see it as a harmless suggestion to offer. AITAEdit: I say ""it"" because idk of it's a baby boy or girl. Isn't that how you refer to babies?"
7,Not the A-hole,AITA for calling a guy a sexist pig,5159,m1c86r,331,"So, I’m in wood shop at my school. I don’t look like the kind of person you’d see in wood shop. I’m 4’8”, 75 pounds, my hair and makeup are always done, and I wear a lot of skirts and dresses to school. But my dad owns a hardware store and I’ve been building since I could walk. My school has this thing every March where you go to 3 elective classes and watch a 20 minute presentation on what you do in the class. For freshman and sophomore years I was in advanced drama and advanced concert choir and I was in all the school plays and concerts but I also worked behind the scenes and was building these big staircases and balconies and all this other shit but people don’t really see that. So I walked into wood shop for the presentation and this huge guy tried to block me from coming in and said “wrong class, princess. Art’s down the hall.” I told him I know and I was there for the wood shop presentation. This dude smirked and said some bs about me not being strong enough for that class then said “this is why girls aren’t in wood shop” I said “yeah because this class is full of sexist pigs” and went to the choir class to help the teacher with his demonstration. Well, in an unexpected turn of events, wood shop isn’t offered at my school anymore because the teacher retired and they can’t find a new teacher and that guy is in the drama class that I TA in. He’s complained to the teacher countless times about how I’m rude to him and that I grade his work unfairly (such a bitch move to take points off his tests for questions he got wrong and arrange the seating chart so he’s not with his friends because when they’re together they’re very disruptive) so I wanted to know if I’m an asshole for calling him a sexist pig last year because it’s causing problems in my class now"
8,Not the A-hole,"AITA for not paying ""my share"" of a debt?",4744,m19g2f,482,"This happened earlier today during our last class. (I live in Norway, so lockdown isn't very harsh right now.)I went to my table and found a leather bracelet with what seemed to be gold attached on it. I would just like to clarify that it was on top of my computer which I had left on the table to go talk to some friends.So I pick up the bracelet and look at it for a bit, and while I was admiring it, the dude in front of me (let's call him Joe) turned and asked if he could take a look. I told him ""Sure, do what you want with it, it ain't mine,"" and gave it to him.Thing is, when I said ""do whatever you want,"" I didn't expect that the first thing Joe would do was to rip it to shreds. I just stared at him blankly, but didn't comment on it.A couple minutes later, the owner of the bracelet (let's call him Phil) found it in pieces on top of Joe's table and began shouting angrily. He said something about how it cost several hundred bucks, and I just thought to myself ""yikes, Joe is in trouble.""That was until Joe began pointing at me and saying that I was the one who gave it to him, making it MY fault. I just scoffed and thought that no one would listen to that BS, but to my surprise, somehow everyone in class agreed that I should be the one paying.I then proceeded to tell them that HE was the one who broke it, and that I only expected him to take a quick look at it or something, and not just instantly destroy it.The arguments flew back and forth for a while before Phil finally said that we should split the price 50/50. I refused. Everyone began calling me childish and stingy for not wanting to pay for something that was ""my fault,"" but I refused every time.I felt bad about it when I came home, so I asked my parents about it, and unlike my classmates, they actually agreed with me, but I'm unsure whether or not it's because they actually agree, or if it's because they don't want to pay.I usually know when I'm in the right or wrong, but with so many different opinions, I really don't know this time.So Reddit, am I the asshole for this?UPDATE:After reading your comments, I noticed that many of you think that it's a scam, but I can personally confirm that it's not. I worded it really poorly, sorry for that, but when I said ""rip it to shreds"" I meant that he ripped the gold from the leather part. The thing was actually plated gold as far as I could tell, so I doubt that it was a scam. I realise that I only mentioned gold once in the post, and not even confirming if it actually was or wasn't. Again, I worded it badly, and sorry for the confusion."
9,Not the A-hole,AITA for telling my MIL we put all the things she bought for the baby by the side of the road?,3818,m1aart,292,"I expect this will divide opinion so need a balanced perspective. My (29F) husband (32M) has a stepmother (55F) called T. T is an over-gifter and always goes over the top despite us asking to only get one or two things. Its quantity over quality, not to our tastes and rarely something we want or need. It takes a long time sorting what to donate and what to bin. Sometimes the stuff is visibly dirty from being in their house (they live in squalor.) T also has mental health issues, she can be emotionally volatile and uses her vulnerability as a weapon. We are new parents to a week old baby. Family has been supportive and helpful. T has been very over the top. She wants to see the baby immediately and drop off some gifts, we said we don't feel comfortable with that (they live far away and just had covid) they were upset. Today we get a text saying ""baby stuff is outside."" We find 6 huge bin bags, 3 large boxes and a bunch of smaller bags full of stuff. Looking through we find dirty, stained blankets and clothes, and other stuff we have no need or use for, they never asked us what we need.Husband is angry, I write a text to T:""Hi T, this is a lot of stuff. We're grateful you want to provide for your grandchild, but we asked you not to get too much. A new baby does not need a lot, we already have a lot of the things we need and we do not have space to store any more. We also asked you not to travel to bring it. We are hurt and disappointed you went against what we asked, even though it is for a kind gesture. Your generous nature is one of the things we love most about you. The most generous thing you can do is respect our wishes. From now on please ask what we need and get only what we have asked for so we can make sure we only have what we need.""I get no response. After a while I start looking through the stuff and I'm angry. Angry at the amount, angry at the quality and angry that they went against our wishes. I send another text:""T, I have just seen the extent of it. You have gone against our wishes and gone too far this time. We have put it all by the road and posted it to facebook as free to collect for someone who needs it. We are hurt and disappointed by your actions. You need to think about how you respect our wishes regarding (baby) in the future."" Her response was that they will stay away from us because clearly we don't want them in the baby's life. This is not what we want.I understand her gift giving comes from love, I also think its due to trauma in her past. She's not a bad person. I feel awful for telling her what we did. Imagine buying all that stuff, then told it has been put by the road. At the same time I want to give her a wake up call. That she would choose not be in her grandchild's life rather than respect our wishes is upsetting.Was the second text message justified or was it too much?Update: I wrote this post last night. The update today is I had a call from the council and my FIL has reported me for fly tipping. I had to explain to the council the stuff was on my driveway and collected as part of a private sale. My FIL is equal in his part in this. ETA: fly tipping is the illegal dumping of waste in a place where waste should not be dumped. It is a criminal act punishable by a fine. In the message I told them we put the stuff ""by the road"", this would be illegal. Actually the stuff never left our property, someone from facebook collected it for free from our driveway, perfectly legal."
10,Not the A-hole,AITA for not refunding an Airbnb guest that damaged my home?,971,m1is3d,155,"Ok this is going to require some background to tell the full story. My wife and I run an Airbnb in our home that we also live in. We had a guest, we’ll call her R, that reached out to us through Airbnb to book a room. In the end we made an arrangement with her outside of Airbnb for her to stay a month in a small room. She paid us and moved in and everything seemed fine. About a week into her stay, at around 4am I heard a crashing sound but ignored it and went back to sleep. Later in the morning I’m woken up by R walking into my bedroom followed by my wife yelling at R to go back to her room. Finally R returns to her room but only for a few minutes before walking outside and away from the house in the middle of winter with no shoes on. We call the police to hopefully get her to a hospital, which ends up happening. Best we can figure R had some sort of mental breakdown because she was like a zombie and was non responsive. Upon going through her room later we found drug paraphernalia (a small cylinder with burns on the end of it), so it might have been drug induced. In her room we found a huge hole in the wall (I assume that was the crashing sound I heard). Throughout the house we found signs of her entry and found some items moved and/or damaged. The damages required us to spend money on repairs.We tracked down R in the hospital and brought her her phone and insurance info. She claimed she had a seizure but we are skeptical. Anyway we told her we could hold onto her stuff until she got out but when she did she would have to find another place to stay. Toward the end of the month that she had paid for she texted us and stated we could bring her stuff to the facility she was staying in and that she deserved a refund because we told her she had to find another place. We returned her stuff but denied the refund request with the thought process that she caused damage to our home and it’s not our fault that she had an episode and didn’t use the time she paid for. Plus we kept her stuff safe for the whole month. Arguments that IATA include that she is likely mentally ill and she told us she was poor and needed the money. Also the cost to fix the damage she caused was not equal to the amount she paid us initially."
11,Not the A-hole,AITA for putting rules on mental health days?,4314,m186bh,760,"Oblitory throwaway for privacy.I am the mother of 2 teenagers. A 17 year old junior, Suzy and a 14 year old freshman, Tom. During Suzy's freshman year, her workload and stress was thru the roof so my husband and I decided we would implement ""mental health days"". We had no rules for a day other than be reasonable about when you take them and they couldn't be on test days. This worked great and over the past few years, Suzy spread out her days throughout the year and only took about 3 or 4 each school year.Tom is where we come to our problem. He is also allowed mental health days with the same rules and expectations, but he has taken advantage. This year alone, he has taken about 25 days. He hasn't been using the days for his mental health, its been for sleeping in because he wants to stay up all night(no bedtimes, just have to get up in the morning no matter when you went to bed), hanging out to get more time on his video games, or to hang out with friends that skip.this came to a head last week when he was talking to us at dinner about a game release coming up and how he plans to use mental health days so he can stay home and play.Tbh, I was fuming when he said this. I told him he had no more mental health days he could use this year and they are not for video games. He yelled that he could do what he wanted for his mental health days. I informed him there would now be rules on them. They can no longer be used to sleep in, they couldn't be used to sit and play games all day, and they would not be used to hang out with friends. I told them all if you had to take multiple health days a month, you would be attending therapy. The kids were mad but my husband agreed infront of them.When we were alone, he blew up on me saying I couldn't put rules on mental health days and I was being cruel to our kids. I argued back that our kids were not going to walk all over me when it comes to these days and if it continues, then I'm ending them all together. He called me a bitch and now we aren't speaking(when not in front of the kids). AITA?"
