,judgement,title,score,id,num_comments,body
78,Not the A-hole,AITA for telling my brother I won't stop supporting and being there for my nephews?,2513,m0if3z,220,"So my brother has two sons from his first marriage who are 16m and 14m. My brothers first wife/their mom died a decade ago and he remarried 8 years ago. The boys have pretty much never accepted his wife as their mom. I don't believe they treated her badly but they didn't treat her how my brother and his wife wanted her to be treated. They wanted their dad for everything, wanted him to keep bringing them to school, wanted him for bed time and stuff like that. The oldest would especially ask for that. And my brother would always say he couldn't but their stepmom would. It got to the point where after three years and when my younger nephew told them she wasn't his mom age 8, after two years of them being married, they got the boys counselling and started family therapy. Nothing changed. They had two kids together. Nothing changed. The boys are much closer to each other than their younger siblings. I honestly don't know that they interact with the littles at all.It got bad several months ago. They were doing virtual sessions where the therapist was trying to help them set boundaries with my brother and sister in law when my younger nephew said something that changed things. The therapist was asking him to say something along the lines of ""stepmom, I love you and I appreciate you but I don't want to call you mom because I feel like that is something special for my mom"". My nephew said no and when asked why he said it would be a lie because he doesn't love her. My older nephew chimed in saying he felt the same and ever since my brother has been pissed and the boys have been treated different by them. Neither mind. Which drives my brother and sister in law crazy. My brother had the attitude if they didn't appreciate what she did then they could take care of more for themselves, but both seem to be thriving with it and not missing her.I don't like it and nothing has changed with my nephews. They have opened up to me about how they just never grew to love her. My older nephew said it's not that he doesn't appreciate her trying and being nice but he just doesn't love her and they both admitted had the marriage failed (which it almost did pre lockdown) then they would have chosen not to see her on a regular basis and would not have wanted her in their lives really.My brother is pissed that I am still close to the boys and treating them as normal. He told me they believe treating their mom this way is okay because I have no problem with it. I told him he can't force them to feel a certain way and I certainly wasn't going to punish them for being honest in therapy.A friend told me that the boys have been really unfair and they feel supported and validated in treating my sister in law like shit and maybe I should follow their lead for a while.What do y'all think? Am I wrong here?AITA?"
79,Not the A-hole,AITA for not making my bf apologize to my mom & sister?,7568,m0ds49,744,"**Update:** Wow! I did not expect this much support :) After reading your comments and a long talk with the bf, I decided I needed to cut ties with mom & and Jen. In fact, he pointed out that if we had kids, the mistreatment could extend to them as well and that settled it for me. I blocked them both and sure enough, relatives were calling/harassing me left, right & center. I blocked all of them too except an aunt and two cousins who actually took time to listen to me and apologized. Honestly I've never felt this scared but happy in my life. I am literally shaking as I type this. Thank you guys so much! Had I not gotten such overwhelmingly amazing support on here, I might not have taken this step!So I was talking on zoom to my mom & sister Jen (fake name). At one point, my bf came in & handed me some tea as I had killer menstrual cramps and tea helps. When Jen saw this, she said my bf's actions were ""offensive to women"" and treating me like a fragile princess was enabling me. She said her husband doesn't help her whether she's well or sick and that's how a partnership between equals works.This made me mad. My bf is a sweetheart and he understands that this time can be painful for me, so he helps out in whatever way he can. I told Jen that when I'm well, I take care of him as well - pack his lunch (his office has reopened, but my college classes are still online), make him breakfast etc. She got even more angry and congratulated me for becoming a 1950s housewife. This was crazy! I love taking care of my bf, but that doesn't mean I'm giving up on my career. It's just that I'm a morning person, so I handle morning chores, he does nighttime chores.Jen went on about how offended she was until I left the call. Later, mom, unbeknownst to me, texted bf and asked him to stop helping me out whenever I was zoom because it upsets Jen. He didn't take her seriously, at which point she said he - an outsider - was disrupting internal family matters (This is the man who has made it abundantly clear that the minute our financials are in order, he's asking me to marry him). He lost it and said he'll take care of whoever he pleases in his own house.So, this is where it might have gone into a-hole territory. As my mom persisted, bf said he had to look out for me since no one in my family would. This is not very far from the truth. Mom thinks older children always get the short end of the stick and has over-compensated by going the other way (e.g. I wasn't allowed to cry as a kid because ""younger children get it easier, so my problems were nothing in comparison to Jen's"", I had to share my birthdays & milestone events with her so that she didn't feel bad). This used to hurt, but I've made my peace with it.Now my extended family is blowing up my phone, saying we were rude and hurt mom's feelings. I got a text from my mom saying she did her best to be a good parent, but she was only human. This made me feel terrible tbh. But then she added that she expected bf to apologize to her and Jen on zoom in front of the entire extended family. I lost it! I'm not going to make him apologize for taking care of me just because they feel offended by it.So AITA for not making my BF apologize to my mom & sis?"
80,Not the A-hole,AITA For 'faking' a fainting spell?,4609,m0f4lj,374,"Just a note, I didn't actually fake it but I did dramatize it. I (17F) suffer from several medical conditions, one of which is fainting. We're still trying to figure out why this happens, but it does. I have a service dog, who is honestly the light of my life. He has saved me in so many ways and I'm forever grateful. I live with my dad but recently he's been hospitalised and it's not safe for me to be alone, so I'm staying with my mom, her husband and their kids. They refuse to acknowledge that my dog works. They constantly try to overfeed him, or give him food he is not allowed, and are always trying to distract him. No matter how much I tell them to leave it, they won't. He's almost missed several cues, and I am getting increasingly worried. If I were to have a seizure and he not alert me beforehand I could very easily fall and hit my head too hard.So, the other day, they were once again fussing over him, after I had told them several times to leave him alone. I went to walk over and remove him from them when my vision went blurry. This is a sign of a fainting spell, and when I can tell I'm about to have them I usually sit back down. I decided against it, and as one would imagine, fainted. I hit the ground pretty hard and had a headache, but most of the impact was on my arms. Even through this whole thing, my stepdad held my dog back while my mom tried to figure out what was wrong. I snapped and told him to give my dog back once I came around, and have since decided I'll take my chances living alone for a while. My dad found out I was planning on going back home, and called to ask why. I explained what had happened, and he asked why I had allowed myself to faint on the floor (he knows I can usually feel them coming) and I explained that I wanted to see if they would actually let my dog do his job. I'd rather faint in a more controlled way than have a seizure and not know if they're going to help me. I guess my brother heard and basically told his parents, both of which blew up at me for scaring them. Yelling triggered my PTSD and they once again refused to let my dog near to help. I have since left, and everyone is blowing up my phone, calling me an evil bitch for scaring them like that. My dad said I shouldn't of done it, and says I need to make up with them so I can go back, because he doesn't want me staying alone. I reiterated that even if I stay with them I'm at the same amount of risk because they won't help. At least here I have access to my dog. Am I the asshole?"
81,Not the A-hole,AITA for saying something I didn't need to?,7,m1ioo6,15,"Throwaway because my main account does have pretty obvious ties to me.For background, I (18) live with my grandma (80). My grandma can't drive. She never got her license, so my parents (mostly my mom) have mostly driven her to stores, appointments, and the casino. Since the pandemic, I have primarily taken on the responsibility of taking her grocery shopping every two weeks (for about two and a half hours) and to appointments about once every couple of months (anywhere from one to two hours, but typically only one). This is also my first year in college which I have been taking some time to adapt to.Usually, I don't mind taking her. She also pays me after I drive her which, while I appreciate, I would much rather her pay me maybe once a month instead, if anything, because I feel that it is my responsibility to take her and I don't need to be paid to be doing this.This is the week before my finals. I have my first one on Saturday in a very difficult subject for me and as such, I am trying to get as much time as I can in studying. I could have done a lot more studying last week, but I was fatigued because I had just finished taking my midterms (I am on a quarter system). So I fully take responsibility for that mistake, but I can't do anything about it now and just need to study as much as I can now.She asked me to take her to do a urine sample today. So I took her at about 9 AM and it was quick. Then she got a call that she has to go back in because she didn't give enough urine. The reason she didn't give enough urine was because she went to the bathroom right before we left to get to the office (about a 10 minute drive from our house). My dad said he could take her again at 2 PM because I am in class from 12:30-3:00 today. It turns out she declined my dad's offer. When I asked her why she said that she already told the office she couldn't make it today and would come tomorrow. I was upset because I knew that would mean I have to take her again tomorrow, despite her having the opportunity to go back today. The office isn't by appointment either, it's all just by drop in so I don't really know how much it would have mattered that she told them she couldn't come back?This is where I think I might be an asshole. I told her that I need to study. She said, ""It's only an hour."" I told her I know but I really need to study because my first test is on Saturday. I know she's mad at me because a little bit after that I asked her if it was fine to go tomorrow after my only class instead of the morning because I want to try and get some work done before. She didn't say anything and just shrugged. Later, she told me I had a package in a aggravated tone.I just feel like an asshole because I probably should have just kept my mouth shut, and because she pays me, but I was just so annoyed because I felt like my time was not being respected."
82,Not the A-hole,AITA for wanting compensation?,10,m1gt7y,30,"Quick back story, my (34m) wife (30f) and I have been married for 5 years. Together for 7. And in the past 2 and a bit years I have been working a fly in fly out job making good coin in the mines. So I'd be away from home for 2 to 6 weeks and home for 1 to 2 weeks before back to work. In the time I was away my then wife had to build a sort of normal life to deal with the time I wasn't around and as such I felt like an outsider when I got home. Jump to last august and she said she wasn't happy and wanted to ""act like we were separated"". I did up a spreadsheet of our assets with a ""short term"" ""long term"" and ""permanent"" separation options and found a new place to live. I moved out the next day and we sat down and went through the spreadsheet to which she agreed we were in long term and as such I left most of what we had with her in the house. Took a small amount of spare furniture, beds, etc. And bought new fridge, washing machine, and the rest to replace everything else I needed. This was fine to me as I wanted to make it work. Our five year anniversary came up a month later and I did up a wedding slideshow that id been working on since February trying to get pics and videos of friends and family (we didn't have a videographer). She said we could maybe get a meal and talk. But then nothing. Didn't answer her phone. Didn't reply to me until the next day saying she was busy with friends. Long story short over a few months I tried to talk with her about it. Work out what actually happened (there was no cheating or violence or aggression from either of us). And all to no avail. She would talk when she was ready. I ended up going to a mediator to discuss what was going on and split things more fairly for a permanent split. She brought her mum as her silent support person (who wouldn't shut up). And they had decided that I got the TV and cheap second hand car. And that she should keep everything else (including my dog). At this point ill add that I just finished helping her pay off all her debt (and was left with 20k debt of my own) and just finished building a verandah for the house (owned by her mum) to the tune of 15 grand. The house itself included thousands of dollars of equipment and furniture and basic appliances id already bought replacements of and in a private conversation she agreed that she would pay me half the verandah and half the bond I'd paid for the house and we both be on our merry. 6 months on and I havent seen anything. She keeps side stepping and my friends are in 2 minds. Just forget that I'll ever get the money and move on. Or fight and take what I deserve. Including my doggo. I messaged her again asking when I can see this money and she's pushed me back to July 2021. I'm starting to get ancy but don't know if I'm in the right here. So. Am I the asshole for wanting compensation from her?"
83,Not the A-hole,AITA for wanting more time for myself?,6,m1iksq,30,"My (23, F) boyfriend (22,M) and I started dating a year ago today, actually.True definition of a pandemic relationship at the beginning. School was online, we basically lived together, spent every day 24/5-6 together. And we got along really well!!I graduated college May 2020 and moved an hour and a half away from him. Since then, the small signs of jealousy & trust issues got even bigger!! At least once a month we’re having a fight about something having to do with jealousy or distrust, neither of which I did anything to deserve. I’ve never cheated, never lied, never deleted a message. It’s his trauma & I understand that, so I try to be really patient.I’ve been really stressed with money, just paid off $4500 in debt these last three months. I’m working a ton, trying to workout, I am the ONLY person in my house who cleans regularly, and I honestly just feel like I have no time for myself.My boyfriend and I used to see each other every weekend, but I asked to move it to every other weekend. It took almost a month before we finally followed through on it.Now, this last weekend, we took a trip to another city & got a hotel to celebrate our anniversary. I planned it this way specifically because our anniversary falls in the middle of the week & is harder to plan around.Last night comes around & he’s asking what time we’re having dinner for our anniversary tonight. I said “I thought we had planned not to do anything, since we just took the whole weekend!”. Mind you, we did brunches, dinners, bubble baths, wine, the whole nine yards.He is insistent, which I get. It’s our anniversary & it’s special. He’s coming to my town to have dinner & I think it’s sweet he took on the drive just for that.He’s on his way right now, but I asked him if he could head out after dinner, and he flipped out. I have to shower tonight, I just got my car wrecked into over our anniversary weekend, I have so much to do that I can’t seem to find the time for each day this week & he is mad at me! I told him I wanted the extra time to pamper myself & decompress, and he hits me with the, “oh, well I thought hanging out with me made you feel relaxed. I didn’t realize it stressed you out.”Y’ALL? Am I not seeing something? Am I the asshole, after planning our entire anniversary weekend, for wanting extra time to take a bath instead of a shower & feel rested after dealing with insurance & work & housekeeping every second since I stepped through my front door on Sunday afternoon?TLDR it’s my anniversary & my boyfriend is coming up for dinner. We just spent a weekend away for our anniversary, and I’ve been really stressed, so I asked if he could head home right after dinner because I want some time for myself tonight & he freaked out. AITA for not wanting to spend more time together on our anniversary, even though we just took a weekend to celebrate it? Help me."
84,Not the A-hole,"AITA for not wanting to clean the bathroom I share with my nieces every week and calling them spoiled, then moving out?",510,m0ta3i,132,"Every Friday I (f20) clean with my family. This has been our thing for ages. Clean up day is Friday and everyone does their part, you make the mess you clean it. Since 12 I had cleaned my own bathroom, vacuumed the entire house or the top floor and did dishes. I remember one time when I was 13 my mom made me do the dishes until I finished and I didn’t stop until 2AM. In high school When I lived at my sister’s house I cleaned the bathroom once a week. Even in boarding school when I went to slept at my sister’s for the weekend, I would still have to clean the bathroom.Now due to covid I had to live with my family in their new house last semester. I slept in the office since the house doesn’t have an extra room. I also ate my own food usually and had to pay them $250 a month to sleep in the office. I really didn’t care until somehow my payment included me cleaning the bathroom again regularly.I don’t mind cleaning the bathroom at all but her kids are about 10/12 now and have zero responsibility. Meanwhile when I was that age my sister and mom had me cleaning all the time. So now she wanted me to clean the bathroom I shared with her kids every week and I would not have cared if her kids were not spoiled, disrespectful and messy. Every Friday I had to ask her kids to pick up their piles of clothes from the bathroom to which they would argue with me and my sister would say “just shut the fuck up I’m tired of you arguing with kids about cleaning! Just shut your mouth and clean it” So I did. For weeks I cleaned the damn bathroom with shit stains and clothes everywhere. Her kids had zero consideration and would also do “science” experiments in the bathroom and squeeze toothpaste all over the mirrors and what not. I could not even put my own things in the bathroom because her kids would brake it. I constantly was cleaning up after every mess they would make in the bathroom and their parents would not care to discipline them. They still don’t even flush because they know that I or someone else will do it. I would refuse to flush after them and tell them to but then they would argue with me and my sister would just say flush it because they won’t listen. Their dad basically does all their chores for them bc they don’t want to deal with their tantrums. I pointed out how spoiled they were to my sister and how I wouldn’t mind cleaning the bathroom if they did the basics of cleaning up after themselves but she says I’m being lazy and unwilling to do my part in the house. Her and my mom would defend them bc they are kids and I’m the adult. So I moved out. Now my sister is still salty over me leaving and I don’t even like visiting her house on the weekends because somehow they find a way for me to clean it. I’m not expecting her kids to be maids or anything but they lack any form of respect aside from doing basic chores. AITA for not wanting to and calling her kids spoiled for not having to do the things I did at their age?Edit: I do not think my sister is a terrible mother and her kids aren’t being neglected or abused. They both refuse to listen whatsoever when their parents try everything but give in once a tantrum ensues. They know I don’t give in to the tantrums and that also annoyed their parents bc we can hear them screaming and yelling all day bc they didn’t get their way.Edit 2: I see what you all mean now, I just never thought like that before. I was adopted by my family at 12 and came from nothing. My family taught me about give and take, “we put a roof over your head” so I should clean. She isn’t doing her job as the parent I agree, thanks for the eye-opener...."
85,Not the A-hole,WIBTA if I sold the house my parents live in?,405,m0uohb,99,"Background: my sister (29) and I (30) bought the house my parents (45F and 42M) now live in about 8 years ago, taking a loan out while I was still in University. Our parents' credit was terrible and they were being evicted from the house they were renting (using my sister's income to pay the rent). As a family, we agreed that buying the house for them would allow them to rebuild their credit. My parents paid the mortgage as their ""rent"" and have the run of the property as if it's their own -- we never wanted to profit off them. My sister and I have now bought our own houses with our fiancés, each taking on second loans.The house burned down in September and my parents lost everything. Luckily, the insurance I selected (and paid for up to a few months before the fire when they took over the payments) will cover everything. My parents have already gotten a new (to them) truck and an RV (which they're living in until the new house is built) and there is still money leftover. None of which is going to my sister or myself.During all of this, the relationship between us and our parents has become incredibly strained. They have made comments that we aren't doing enough, that the insurance isn't enough, etc. and my sister and I want out of the situation completly. When we've brought this up, suggesting they take over the remainder of the loan, our parents won't hear any of it, and have even said that ""nobody is going to sell their house out from under them.""WIBTA for selling the house ""out from under them"" if they continue to avoid taking over the loan? They're my parents and they have relied on my sister and my income since we started working at 16 y/o but they are making more now than we were when we bought the house. My sister and I are trying to plan our lives entering our 30s but our parents obviously need us..."
86,Not the A-hole,AITA for beating my girlfriend in board games?,82,m131cn,73,"My girlfriend and I love playing board games togehter and most of the time we play against eachother. When we play games that heavily involve stratergy I win about 95% of the time. Now I don't have a problem with losing but I am competitive and usually try my best to win, as it helps me explore and appreciate these games. There have been a few times where when we my a few games or rounds in a session my partner gets upset after I have won multiple times in a row or if she hasn't won at all. Sometimes I do intentionally not play optimally which she sometimes (not always) picks up on and gets mad at me for letting her win.I feel like i struggle to find a balance of playing a game where I get to play hard, so that I enjoy it and not making her upset and even more so if she catches me taking it easy on her. So i want to know if im the asshole for beating her most of the time, or if someone can provide me a different persective to help me with this issue."
