,judgement,title,score,id,num_comments,body
157,Not the A-hole,AITA for ignoring my friend’s emergency call?,73,m0pewo,33,"So the whole story started before New Years Eve. In the beginning of December she argued with her quite toxic boyfriend. We have been friends since we were 7 and till I got married we spent each of the New Years together. So to cheer her up and with my husband’s encouragement I booked for us a trip to a spa resort (and I really needed a break). Just me and her, just how we used to do it. My husband decided to bring the kids with him to his parents and it took quite a lot of organizing and planning. I also paid for the trip as I’m in a better life situation than my friend.One day before the trip she called me and told me that her ex’s mom came to her and begged her to join her son’s massive party (during coronavirus). She asked me to ditch the plans I paid for and go with her to the party. Then when I told her I don’t want to, she said she can’t just not go or it will be over with her ex.The thing with her on and off bf is that he is always breaking up with her. She always needs my support but never listens to my advice.So we talked for hours and she told me I left her first for New Year’s Eve (that is not completely true because I was always inviting her over - she just never came.)  I felt really bad and I knew making her go with me would ruin the trip. Instead of going to the spa I went to my husband’s family and although I love his family this situation just broke my heart and I couldn’t help crying.Two weeks later she called me just to complain about the guy. I got really mad and asked her to never speak to me about him again, but she tried to start this topic many times more. Week ago my husband and I needed to go for the weekend out of town for a funeral.  So I asked my friend to take care of my kids for a few hours till my in-laws can take over. She said “sure, no problem”. On the day of the funeral I couldn’t reach her. No one else could help me out so my husband went alone - again, broke my heart.She called me at night, crying and begging me to pick her up. I thought she was in danger, but as she explained she needed a vacation with her boyfriend and they argued. He locked her out of the room and she had no money and nowhere to go, it was really cold and she was scared, her phone was dying. So she wanted me to drive 2 h one way to pick her up. I just started screaming at her for not letting me know in advance she won’t take care of my kids and I hanged up.She spent a night on the street and apparently her bf let her back in the next morning. She said I stabbed her in the back. Some of our mutual friends stopped talking to me. (No one is mad at the guy because “you know how he is”)Our moms put pressure on me to apologize and make the first step. But I feel it’s not fair as it all wouldn’t happen if she helped me out in the first place. I just feel like she did me wrong so many times,  but she just depends on me and my money. Am I wrong in this situation? Should I apologize?"
158,Not the A-hole,AITA for telling things to my therapist that i don’t tell my mom?,89,m0nr1e,64,"sorry i can’t really word this situation well but i’ll try my best. Basically during the lockdown period i (15F) started going to therapy because i wasn’t doing well mentally. It really started to make me feel better because i cannot have conversations like that with my parents without them blowing up and telling me how spoilt i am and how i have no reason to feel like i do, so for this reason i do not tell them many personal things but i do try to maintain a good relationship with them. Today, my therapist asked if she could discuss things with my mom. The therapist suspected i had depression and anxiety, and was also doing non-clinical tests for autism. She told this to my mom (with my permission) and i could practically feel her stiffen up next to me. She yelled at me the whole car ride home calling me ungrateful and spoilt and said she was really hurt that i told things to my therapist that i didn’t tell her, like how my dog sadly passed away today and instead of crying to my mom about how much i missed him i discussed things with my therapist. It’s really made me feel like shit and both of my parents keep insisting it’s my fault and i wanted to hear an outer opinion. thanks."
159,Not the A-hole,AITA for not going to work,8,m1251q,43,So a few days ago I messed up and completely missed one of my shifts for my job and when I had realized it it was already too late. I saw that manager had texted me asking where I was so I immediately apologized and said it was a mistake and it wouldn't happen again as this was the first time this had ever happened. She was clearly very upset and wrote back saying that I was getting written up as this was unacceptable and that I won't be going to work this week as she got someone to take the rest of my shifts as punishment. I told her I understood and I apologized once again for the inconvenience and she notified me saying that this cannot happen again or else it will be dealt with repercussions far more serious than this.So I was guilt stricken and felt horrible about this whole ordeal so I scheduled things to do on the days I was initially supposed to be working so I could get my mind off of things. On one of those days I got a call from my manager asking me to come in and work because apparently the person she had arranged could no longer make it but I had already arranged plans because I didn't even imagine them calling me when they made it pretty clear that they didn't want to see me. I told them I couldn't go which probably strained my relationship with my manager even further since she now has to go find somebody else. I feel like I am the asshole because it was my shift originally and it is my fault for not showing up earlier that week so AITA for not going to work?
160,Not the A-hole,AITA for cancelling on a bachelorette party?,53,m0rbas,43,"My (28F) friend (28F) Alexis is getting married.  Alexis and I have been friends since childhood, we live several states apart now, but we're still very close, we FaceTime 2-3 times/week.  So I was really surprised that Alexis didn't make me a bridesmaid.  As she explains it, she felt bad, but her fiance didn't have another friend he could ask to be a groomsman, and as the ""long distance friend"" I was logistically the easiest to cut.  I felt hurt, but resolved to be pleasant and that no one outside my mom and cat would know my true feelings about it.  Alexis asked me to attend her bachelorette party, and I said yes.  Shortly after, her MOH added me to their bridesmaids group text so I could get details about the bachelorette night.  And - holy shit those girls can fight.  What restaurant we're going to, what color the T-shirts will be, blah blah blah it's an argument each time.  I've stayed out of it all because I'm Not A Bridesmaid and don't need to insert myself into those issues.  But it's also a constant reminder of the rejection I feel from being the friend on the chopping block.So after 3 weeks of this, I decided I don't need to put up with it anymore.  I decided I don't need to fly to a party with people I don't like in a situation that would make me feel bad.  So I canceled on them.  I said that work was getting hectic and I couldn't take the time off anymore.  Here's where the asshole part comes in potentially? The MOH has asked us to pay her for the rental house in 3 days, the party itself is in 2 weeks.  My cancellation makes the cost about $25 higher on everyone else.  They're saying I should pay for my share.  I disagree - my assigned room was supposed to be shared with someone else anyway, so she can push the twin beds together now, the 'deposit' is the request of the MOH and not the real AirBnB deadline, they have plenty of time to find a cheaper house with one less bed if they want.  I said all this but I'm still getting a lot of messages from them about how I need to pay up.  To my knowledge, Alexis is completely unaware and uninvolved with the bachelorette party costs.Money is tight for me - I'm a medical resident with a lot of debt - I don't want to pay for a party I'm not going to.  But I also want to keep the peace.  So Reddit, am I acting reasonably or AITA?"
161,Not the A-hole,AITA for referring to my food intolerance as an allergy?,1499,m06ze2,442,"I (28f) have a nightshade intolerance. In particular, potatoes/ potato starch make me incredibly sick to my stomach. People tend to not take me seriously if I say I have an intolerance. I get sick even if my food is touching fries or chips, yet sometimes waiters will ignore me and serve them anyways. For some reason people seem to think an intolerance is a diet choice rather than an actual medical issue. As a result, I’ve started referring to it as an allergy when I go out to eat. On Friday I was out to eat with some family friends and when I mentioned to the waiter that I had a potato allergy, one family friend interrupted and said, “oh it’s not an allergy, it’s not like she’ll die!” Luckily my mom was with us and immediately spoke up that while I might not die, I do get extremely sick, so it is important that I not be served anything with potato. Am I the asshole for technically being dishonest and saying I have an allergy so that people take my intolerance seriously?"
162,Not the A-hole,AITA for not making my daughter rehire the neighbor girl to her small business?,3188,m030m0,478,"My daughter (12) started a small business with birthday money she’d saved up. She hired a few kids from the neighborhood to work in her business once it started to grow. One of the neighborhood kids she hired wasn’t doing satisfactory work, so she ended up having to fire her. I stayed out of it. Not my place to micromanage. The mother of the child my daughter let go contacted me and said her child was feeling left out now that they couldn’t participate in the business and asked me to instruct my daughter to rehire them. I explained I’m really not involved in her business at all, so I didn’t feel right doing that. She said it’s all well and good to stand back to an extent but when it gets to the point that it’s exclusionary it’s my responsibility to step in as the parent, because now her child’s feelings had been hurt, and that’s more important than how lucrative my daughter’s business is or isn’t. I told her I couldn’t help. She was pretty flustered and said I could help but was choosing not to. It got to a point that I more or less had to ask her to leave my house. I see both sides, and worry I was harsh in what I said to her or should have given her concerns a longer hearing. But I don’t know what else I could have said (or not said) to her. AITA for refusing to intervene?Edit: typo"
163,Not the A-hole,AITA For getting mad at my mom because she told me that my art was horrible?,37,m0sia7,25,"Context: My mom was looking at my middle schools art show back in 6th grade. She saw the drawing i had put in there, and told me that she was ashamed that i would make it. I was super confused at first, and asked what was going on. She showed me the drawing that i had submitted, and glared at me for a while, which obviously made me kinda annoyed. The drawing was from back when i was testing out with different styles, and the drawing was a abstract one, where i used the lines of notebook paper to decorate. The notebook lines were drawn on, and there was a space where a anime girl was seen walking, with no lines. After that there was patterns and doodles, with little eyes that didn’t have lines too.My mom is the realism type of person, who doesn’t like abstract or fantasy type drawings. Now, my mom told me that this was unacceptable, and that she was ashamed i would even use notebook paper. I told her i didn’t, and she yelled at me for apparently lying. I told her i was only 11, and this was 3 years ago, and what do you think you’re gonna change by yelling at me? After that she yelled at me more, saying how i could be good at art, but i draw all this stupid “chinese cartoons” (anime style), and that i  this is part of the reason i can never be a artist or photographer (the two things i would wanna do). I got mad and told her that i would never even want to be a lawyer or doctor like she says, and that i would hate it working as one. We yelled for a while, and now i feel humiliated and angry, and my mom is just going on about how shes gonna have a heart attack because I’m apparently so bad  and disrespectful. Am I the Asshole?"
164,Not the A-hole,WIBTA If I didn’t use my sister’s wedding planning business for my own wedding?,102,m0lhnd,34,"My sister quit her job as an event coordinator with a hotel a couple years ago so that she could pursue running her own small business specializing in wedding, party, and event planning. The business consists of her doing all of the planning, then the day of the event pulling in my mom, dad, maybe myself, and maybe my now fiancée to boss around and do all the physical work for free. I don’t like this at all, but I usually help because family.I recently got engaged, and my fiancée and I have been laboring over the issue of “how do we handle this situation with her”. I’m very much on the camp of “it’s our day and about us, so we tell her no and frame it as we want her to enjoy the event and not have to be working” but my fiancée thinks it won’t be that simple.On my sister’s business Instagram page, she would post things like “Did you get engaged recently...[more post text]. I actually know someone who did, and I’d be willing to give them a family discount )” or using our engagement picture to post and saying “Congratulations!....[post text], I also know a great wedding planner/florist/wedding decorator that would be able to help you out )”We’re also somewhat worried, as we’re planning an engagement party out of state with some extended family. While planning it I asked my parents “Is this just going to be a dinner and everyone hangs out affair, or is it going to be a whole decorations kind of ordeal” to which she responded “You don’t think your sister hasn’t thought of that already?” I’m willing to ride this party out and see how it goes, but I am worried it won’t end too well. Usually, a sister planned event devolves into her and my mom arguing about things at the event and everyone “working” in a bad mood. I don’t like her style at all as it is very HGTV and repurposed things (think painted wine bottles as centerpieces). On top of this, my fiancée helped my sister run a wedding (sister was day-of-coordinator, fiancée just helped with whatever she needed), and she told me it was close to a shit show—the bride was flustered the whole time, things were a bit disorganized, sister wasn’t very assertive or in charge etc.Context out of the way, would I (we) be the asshole if we didn’t utilize her for the event? I really don’t want to pay her for what I know will be 1. More stress 2. Nothing extra added, and 3. An excuse to become free advertising and plastered all over the business Instagram"
165,Not the A-hole,AITA For Calling My Mom An Ass?,71,m0npob,26,"Background: I (23f) started dating my bf (25m) about 1.5 years ago. However, because of you know what, my bf and my family have had limited contact due us living in the west coast and them living in the midwest. Recently, my mom (64f) got the vaccine so she came to visit me and requested she meet my boyfriend by going out to dinner at a restaurant she liked. I am Chinese-American and my parents are naturalized citizens coming from a very conservative area.We kind of started on the wrong foot: my bf showed up 5 minutes late. He parked in the wrong place and had to walk a couple blocks. Not a big deal to me, but my mom said that it was completely unacceptable. ""girls should never have to wait for a man"". When he arrived my mom made passive aggressive comments towards him about how people who are late are purposely disrespectful and how she never has to wait for her husband. He apologized to her and we walked inside.Throughout the entire dinner, my mom would not engage in conversation with him. Every time he said anything to prompt conversation she would say ""No, No you have no idea, you've never experienced X"" or something to that degree about how hard her life was. He did handle it like a champ and tried to empathize with her. I would even try to diffuse the situation by switching to topics she liked like k-dramas, the west coast weather, the food we were being served, etc. But nothing seemed to work and she wouldn't engage at all. Even talking about my dog, who she really loves when she sees him in person, she would just talk about how much he pooped and peed and how sharp his teeth were. Then,  she got really drunk, and started talking about politics. I won't go into it too much, but she made some extremely racist comments. I had no idea what to say, but my bf just said to treat people we want to be treated and mentioned my parents were ""new here too at one point"" alluding to their immigrant status.When he went to the bathroom, my mom told me that he was acting like a ""smart aleck"" and that he was rude for calling them ""aliens"" (he did no such thing). I couldn't handle it anymore so I told her ""He's just trying to keep the conversation light. Not everyone has to kiss your ass when you're acting like one.""That really set her off and she was so upset she left the dinner early and sat in her car.  My bf and I agreed it was a hard night, but he's not really asking for an apology. After me and my bf finished eating (it really was a lovely dinner after she left) I went to the car she was in. She says my boyfriend is bad and disrespectful, but the real reason she left was because I called her an ass which showed I wasn't on her side. This is where I think I was wrong. I still think my mom is an ass, but I could have said it differently. On the other hand, she was being relentless in being an ass and part of me feels like she really deserved it. I'm not sure. AITA? ESH?"
166,Not the A-hole,AITA for opening card packs without asking?,17,m0xjyd,26,"So, yesterday my(23M) dad(46M) had gotten some magic cards in that he had ordered. He ordered a box of 36 packs of Ikoria. While he has only just gotten back into Magic after about 15 or so years and I for the first time, he and I have played Pokemon and Yu-Gi-Oh! as well. It's always been a think since I was a child and still now as well that regardless of whether it were him or if it were I got a bunch of card packs, we would set it on the table and just open the packs, no asking needed. We've done this for years and were totally cool and fine with it. We have a friend(40M) that we play other games with that found out we got into Magic and he was excited because he has a ton of cards and loves to play. Yesterday, he was staying over(he'd been there for a couple days to help my cousin move into where I live) and my dad had gotten a 36 pack box of Ikoria in and set it on the table and pulled the packs out of the box and set us some each to open. After opening the 3 he'd set to us, I reached over and started to open some more without asking since we've always done just that for years and when the friend had noticed he got pissed off. He started saying about that being rude and how I should always ask no matter what and when I tried to tell him about what my dad and I do, he said he didn't care and said it's still rude. I tried to argue that it isn't rude because we have had it established that it's fine to just take that pack and open it without even needing to ask. He refused to listen and said that it doesn't matter and that it will always be rude no matter what. I blew up and it became a yelling match with him saying that he's ""just trying to help me be a decent person"" by making me ask instead of just me doing so without asking. Eventually we just started ignoring each other and after finishing the opening of them and sorting them by color, rarity and land, I left and went to my room."
167,Not the A-hole,Aita for trying to teach my bf to take responsibility??,25,m0v0yl,47,"For context: I’ve been sick (bronchitis) for the past couple days while staying at my boyfriends house. We are both 18 So to keep it short, my boyfriend and I both have a pair of airpods. He’s hopeless at charging his and knowing where they are, so he lost them. Everytime this happens he asks to use mine, and no matter how much I need them I always let him take them. This morning as he was getting ready for school he asked to use mine and I said no and I told him he needed to learn how to take responsibility and deal with the consequences of being irresponsible. He kept asking and I told him I wasn’t letting him take mine. As he got ready I looked for his and couldn’t find them anywhere, and he left soon after. About a minute after he left I found them in a bag and they weren’t flat so I ran down the road despite being dizzy/lightheaded and having shortness of breath, and tried to give them to him before he got on the bus. I couldn’t see him so I called and was like “hey come back I’ve found them” and he said he was too far away (he couldn’t have been that far) and that it was alright because he had taken mine anyway. I got really mad about this and messaged him and told him I was upset that he disrespected what I had said and I called him unbelievable, and he replied with this “Bruh why couldn’t you just share them I was helping you all day yesterday and you can’t even share your airpods one time. Why can’t you just use mine?” To which I responded with,“Yeah okay I could’ve given them to you but how are you supposed to learn to take care of your own things if you never have to deal with the consequences? I’m not always going to be there to take care of those things for you, or clean your room, or charge your laptop. You need to learn how to do it yourself and you’re never going to if I’m constantly doing stuff for you. I ran down the road to try and give you your airpods because I helped you look for them, I got back and cried because my head started pounding and I couldn’t breathe, I do all this stuff for you and what do I ever get in return? I know you helped me all day yesterday and I really appreciated it but I do so much for you and what do I get in return? You disregarding what I’ve said and stealing my stuff despite me saying no?” I think I might be the asshole because he did help me yesterday and get me medicine etc, and I definitely could’ve let him use them. But I think I’m not the asshole because while I could’ve just said yes, I don’t think he’s ever going to learn if I’m always saying yes instead of letting him deal with the consequences. Plus, he only helped me yesterday because I was sick, other than that he NEVER goes out of his way to do stuff for me. For example, if I ask him to get something out of my bag while my hands are full, he will sit there until I’ve asked about a million times, and he’ll only do it once I get annoyed and move to just do it myself. So, AITA??"
